[INFO] Scanning for projects...
[INFO] 
[INFO] --------------< net.serenitybdd.starter:cucumber-starter >--------------
[INFO] Building Sample Serenity BDD project using Cucumber 1.0.0-SNAPSHOT
[INFO]   from pom.xml
[INFO] --------------------------------[ jar ]---------------------------------
[INFO] 
[INFO] --- resources:3.3.1:resources (default-resources) @ cucumber-starter ---
[INFO] skip non existing resourceDirectory D:\uni\sem 7\IS 3440 - Group Assignment\IS 3440 - Group Assignment\Automation\ITFac_Batch21_Group58\src\main\resources
[INFO] 
[INFO] --- compiler:3.8.1:compile (default-compile) @ cucumber-starter ---
[INFO] Nothing to compile - all classes are up to date
[INFO] 
[INFO] --- resources:3.3.1:testResources (default-testResources) @ cucumber-starter ---
[INFO] Copying 6 resources from src\test\resources to target\test-classes
[INFO] 
[INFO] --- compiler:3.8.1:testCompile (default-testCompile) @ cucumber-starter ---
[INFO] Changes detected - recompiling the module!
[INFO] Compiling 25 source files to D:\uni\sem 7\IS 3440 - Group Assignment\IS 3440 - Group Assignment\Automation\ITFac_Batch21_Group58\target\test-classes
[INFO] 
[INFO] --- surefire:3.1.2:test (default-test) @ cucumber-starter ---
[INFO] Tests are skipped.
[INFO] 
[INFO] --- jar:3.4.1:jar (default-jar) @ cucumber-starter ---
[WARNING] JAR will be empty - no content was marked for inclusion!
[INFO] 
[INFO] --- failsafe:3.1.2:integration-test (default) @ cucumber-starter ---
[INFO] Using auto detected provider org.apache.maven.surefire.junitplatform.JUnitPlatformProvider
[INFO] 
[INFO] -------------------------------------------------------
[INFO]  T E S T S
[INFO] -------------------------------------------------------
Feb 06, 2026 4:00:53 PM org.junit.platform.launcher.core.DiscoveryIssueNotifier logIssues
WARNING: TestEngine with ID 'cucumber' encountered a non-critical issue during test discovery:

(1) [WARNING] Discovering tests using the cucumber.features property. Other discovery selectors are ignored!

This is a work around for the limited JUnit 5 support in Maven and Gradle. Please request/upvote/sponsor/ect better support for JUnit 5 discovery selectors. For details see: https://github.com/cucumber/cucumber-jvm/pull/2498

If you are using the JUnit 5 Suite Engine, Platform Launcher API or Console Launcher you should not use this property. Please consult the JUnit 5 documentation on test selection.
Feb 06, 2026 4:00:53 PM org.junit.platform.launcher.core.DiscoveryIssueNotifier logIssues
WARNING: TestEngine with ID 'junit-platform-suite' encountered a non-critical issue during test discovery:

(1) [WARNING] [cucumber] Discovering tests using the cucumber.features property. Other discovery selectors are ignored!

This is a work around for the limited JUnit 5 support in Maven and Gradle. Please request/upvote/sponsor/ect better support for JUnit 5 discovery selectors. For details see: https://github.com/cucumber/cucumber-jvm/pull/2498

If you are using the JUnit 5 Suite Engine, Platform Launcher API or Console Launcher you should not use this property. Please consult the JUnit 5 documentation on test selection (via @Suite starter.CucumberTestSuite).
[INFO] Running io.cucumber.junit.platform.engine.CucumberTestEngine
16:00:55.412 [ForkJoinPool-1-worker-3] INFO  n.thucydides.core.steps.StepEventBus - Loading JUnit Platform configuration parameters from classpath resource [junit-platform.properties].
16:00:58.029 [ForkJoinPool-1-worker-4] INFO  n.s.r.d.r.RequestSpecificationDecorated - No BaseStepListener, POST /auth/login not registered.
16:00:58.029 [ForkJoinPool-1-worker-3] INFO  n.s.r.d.r.RequestSpecificationDecorated - No BaseStepListener, POST /auth/login not registered.
16:00:58.029 [ForkJoinPool-1-worker-1] INFO  n.s.r.d.r.RequestSpecificationDecorated - No BaseStepListener, POST /auth/login not registered.
16:00:58.029 [ForkJoinPool-1-worker-2] INFO  n.s.r.d.r.RequestSpecificationDecorated - No BaseStepListener, POST /auth/login not registered.
16:00:58.362 [ForkJoinPool-1-worker-2] INFO  n.s.r.d.r.RequestSpecificationDecorated - No BaseStepListener, POST /plants/category/3 not registered.
16:00:58.362 [ForkJoinPool-1-worker-3] INFO  n.s.r.d.r.RequestSpecificationDecorated - No BaseStepListener, POST /plants/category/3 not registered.
16:00:58.365 [ForkJoinPool-1-worker-4] INFO  n.s.r.d.r.RequestSpecificationDecorated - No BaseStepListener, POST /plants/category/99999 not registered.
16:00:58.365 [ForkJoinPool-1-worker-1] INFO  n.s.r.d.r.RequestSpecificationDecorated - No BaseStepListener, POST /plants/category/1 not registered.
16:00:58.439 [ForkJoinPool-1-worker-1] INFO  n.s.r.d.r.RequestSpecificationDecorated - No BaseStepListener, PUT /plants/30 not registered.
16:00:58.542 [ForkJoinPool-1-worker-3] INFO  n.s.r.d.r.RequestSpecificationDecorated - No BaseStepListener, POST /auth/login not registered.
16:00:58.582 [ForkJoinPool-1-worker-3] INFO  n.s.r.d.r.RequestSpecificationDecorated - No BaseStepListener, POST /plants/category/3 not registered.
Feb 06, 2026 4:00:58 PM org.junit.platform.launcher.core.DiscoveryIssueNotifier logIssues
WARNING: TestEngine with ID 'cucumber' encountered a non-critical issue during test discovery:

(1) [WARNING] Discovering tests using the cucumber.features property. Other discovery selectors are ignored!

This is a work around for the limited JUnit 5 support in Maven and Gradle. Please request/upvote/sponsor/ect better support for JUnit 5 discovery selectors. For details see: https://github.com/cucumber/cucumber-jvm/pull/2498

If you are using the JUnit 5 Suite Engine, Platform Launcher API or Console Launcher you should not use this property. Please consult the JUnit 5 documentation on test selection.
[ERROR] Tests run: 5, Failures: 3, Errors: 0, Skipped: 0, Time elapsed: 4.602 s <<< FAILURE! -- in io.cucumber.junit.platform.engine.CucumberTestEngine
[ERROR] Plant Management API.PM2_API_A_05 Edit Plant -- Time elapsed: 4.062 s <<< FAILURE!
java.lang.AssertionError: 
1 expectation failed.
Expected status code <200> but was <404>.

	at java.base/java.lang.reflect.Constructor.newInstanceWithCaller(Constructor.java:502)
	at java.base/java.lang.reflect.Constructor.newInstance(Constructor.java:486)
	at org.codehaus.groovy.reflection.CachedConstructor.invoke(CachedConstructor.java:73)
	at org.codehaus.groovy.reflection.CachedConstructor.doConstructorInvoke(CachedConstructor.java:60)
	at org.codehaus.groovy.runtime.callsite.ConstructorSite$ConstructorSiteNoUnwrap.callConstructor(ConstructorSite.java:86)
	at org.codehaus.groovy.runtime.callsite.AbstractCallSite.callConstructor(AbstractCallSite.java:277)
	at io.restassured.internal.ResponseSpecificationImpl$HamcrestAssertionClosure.validate(ResponseSpecificationImpl.groovy:512)
	at io.restassured.internal.ResponseSpecificationImpl$HamcrestAssertionClosure$validate$9.call(Unknown Source)
	at io.restassured.internal.ResponseSpecificationImpl.validateResponseIfRequired(ResponseSpecificationImpl.groovy:696)
	at io.restassured.internal.ResponseSpecificationImpl.this$2$validateResponseIfRequired(ResponseSpecificationImpl.groovy)
	at java.base/java.lang.reflect.Method.invoke(Method.java:580)
	at org.codehaus.groovy.runtime.callsite.PlainObjectMetaMethodSite.doInvoke(PlainObjectMetaMethodSite.java:43)
	at org.codehaus.groovy.runtime.callsite.PogoMetaMethodSite$PogoCachedMethodSiteNoUnwrapNoCoerce.invoke(PogoMetaMethodSite.java:198)
	at org.codehaus.groovy.runtime.callsite.PogoMetaMethodSite.callCurrent(PogoMetaMethodSite.java:62)
	at org.codehaus.groovy.runtime.callsite.AbstractCallSite.callCurrent(AbstractCallSite.java:185)
	at io.restassured.internal.ResponseSpecificationImpl.statusCode(ResponseSpecificationImpl.groovy:135)
	at io.restassured.specification.ResponseSpecification$statusCode$4.callCurrent(Unknown Source)
	at io.restassured.internal.ResponseSpecificationImpl.statusCode(ResponseSpecificationImpl.groovy:143)
	at io.restassured.internal.ValidatableResponseOptionsImpl.statusCode(ValidatableResponseOptionsImpl.java:89)
	at steps.api.plants.PlantSteps.verifyHTTPStatusCodeIs(PlantSteps.java:128)
	at ?.Verify HTTP status code is 200(file:///D:/uni/sem%207/IS%203440%20-%20Group%20Assignment/IS%203440%20-%20Group%20Assignment/Automation/ITFac_Batch21_Group58/src/test/resources/features/api/plants/plants_api.feature:43)

[ERROR] Plant Management API.PM2_API_A_03 Add Plant with Invalid Category -- Time elapsed: 4.062 s <<< FAILURE!
java.lang.AssertionError: 
1 expectation failed.
Expected status code <400> but was <404>.

	at java.base/java.lang.reflect.Constructor.newInstanceWithCaller(Constructor.java:502)
	at java.base/java.lang.reflect.Constructor.newInstance(Constructor.java:486)
	at org.codehaus.groovy.reflection.CachedConstructor.invoke(CachedConstructor.java:73)
	at org.codehaus.groovy.reflection.CachedConstructor.doConstructorInvoke(CachedConstructor.java:60)
	at org.codehaus.groovy.runtime.callsite.ConstructorSite$ConstructorSiteNoUnwrap.callConstructor(ConstructorSite.java:86)
	at org.codehaus.groovy.runtime.callsite.CallSiteArray.defaultCallConstructor(CallSiteArray.java:57)
	at org.codehaus.groovy.runtime.callsite.AbstractCallSite.callConstructor(AbstractCallSite.java:263)
	at org.codehaus.groovy.runtime.callsite.AbstractCallSite.callConstructor(AbstractCallSite.java:277)
	at io.restassured.internal.ResponseSpecificationImpl$HamcrestAssertionClosure.validate(ResponseSpecificationImpl.groovy:512)
	at io.restassured.internal.ResponseSpecificationImpl$HamcrestAssertionClosure$validate$9.call(Unknown Source)
	at org.codehaus.groovy.runtime.callsite.CallSiteArray.defaultCall(CallSiteArray.java:45)
	at org.codehaus.groovy.runtime.callsite.AbstractCallSite.call(AbstractCallSite.java:125)
	at org.codehaus.groovy.runtime.callsite.AbstractCallSite.call(AbstractCallSite.java:139)
	at io.restassured.internal.ResponseSpecificationImpl.validateResponseIfRequired(ResponseSpecificationImpl.groovy:696)
	at io.restassured.internal.ResponseSpecificationImpl.this$2$validateResponseIfRequired(ResponseSpecificationImpl.groovy)
	at java.base/java.lang.reflect.Method.invoke(Method.java:580)
	at org.codehaus.groovy.runtime.callsite.PlainObjectMetaMethodSite.doInvoke(PlainObjectMetaMethodSite.java:43)
	at org.codehaus.groovy.runtime.callsite.PogoMetaMethodSite$PogoCachedMethodSiteNoUnwrapNoCoerce.invoke(PogoMetaMethodSite.java:198)
	at org.codehaus.groovy.runtime.callsite.PogoMetaMethodSite.callCurrent(PogoMetaMethodSite.java:62)
	at org.codehaus.groovy.runtime.callsite.CallSiteArray.defaultCallCurrent(CallSiteArray.java:49)
	at org.codehaus.groovy.runtime.callsite.AbstractCallSite.callCurrent(AbstractCallSite.java:171)
	at org.codehaus.groovy.runtime.callsite.AbstractCallSite.callCurrent(AbstractCallSite.java:185)
	at io.restassured.internal.ResponseSpecificationImpl.statusCode(ResponseSpecificationImpl.groovy:135)
	at io.restassured.specification.ResponseSpecification$statusCode$4.callCurrent(Unknown Source)
	at org.codehaus.groovy.runtime.callsite.CallSiteArray.defaultCallCurrent(CallSiteArray.java:49)
	at org.codehaus.groovy.runtime.callsite.AbstractCallSite.callCurrent(AbstractCallSite.java:171)
	at org.codehaus.groovy.runtime.callsite.AbstractCallSite.callCurrent(AbstractCallSite.java:185)
	at io.restassured.internal.ResponseSpecificationImpl.statusCode(ResponseSpecificationImpl.groovy:143)
	at io.restassured.internal.ValidatableResponseOptionsImpl.statusCode(ValidatableResponseOptionsImpl.java:89)
	at steps.api.plants.PlantSteps.verifyStatusCodeIs(PlantSteps.java:123)
	at ?.Verify status code is 400(file:///D:/uni/sem%207/IS%203440%20-%20Group%20Assignment/IS%203440%20-%20Group%20Assignment/Automation/ITFac_Batch21_Group58/src/test/resources/features/api/plants/plants_api.feature:27)

[ERROR] Plant Management API.PM2_API_A_01 Add New Plant (Valid Data) -- Time elapsed: 4.062 s <<< FAILURE!
java.lang.AssertionError: 
1 expectation failed.
Expected status code <201> but was <400>.

	at java.base/java.lang.reflect.Constructor.newInstanceWithCaller(Constructor.java:502)
	at java.base/java.lang.reflect.Constructor.newInstance(Constructor.java:486)
	at org.codehaus.groovy.reflection.CachedConstructor.invoke(CachedConstructor.java:73)
	at org.codehaus.groovy.reflection.CachedConstructor.doConstructorInvoke(CachedConstructor.java:60)
	at org.codehaus.groovy.runtime.callsite.ConstructorSite$ConstructorSiteNoUnwrap.callConstructor(ConstructorSite.java:86)
	at org.codehaus.groovy.runtime.callsite.CallSiteArray.defaultCallConstructor(CallSiteArray.java:57)
	at org.codehaus.groovy.runtime.callsite.AbstractCallSite.callConstructor(AbstractCallSite.java:263)
	at org.codehaus.groovy.runtime.callsite.AbstractCallSite.callConstructor(AbstractCallSite.java:277)
	at io.restassured.internal.ResponseSpecificationImpl$HamcrestAssertionClosure.validate(ResponseSpecificationImpl.groovy:512)
	at io.restassured.internal.ResponseSpecificationImpl$HamcrestAssertionClosure$validate$9.call(Unknown Source)
	at org.codehaus.groovy.runtime.callsite.CallSiteArray.defaultCall(CallSiteArray.java:45)
	at org.codehaus.groovy.runtime.callsite.AbstractCallSite.call(AbstractCallSite.java:125)
	at org.codehaus.groovy.runtime.callsite.AbstractCallSite.call(AbstractCallSite.java:139)
	at io.restassured.internal.ResponseSpecificationImpl.validateResponseIfRequired(ResponseSpecificationImpl.groovy:696)
	at io.restassured.internal.ResponseSpecificationImpl.this$2$validateResponseIfRequired(ResponseSpecificationImpl.groovy)
	at java.base/java.lang.reflect.Method.invoke(Method.java:580)
	at org.codehaus.groovy.runtime.callsite.PlainObjectMetaMethodSite.doInvoke(PlainObjectMetaMethodSite.java:43)
	at org.codehaus.groovy.runtime.callsite.PogoMetaMethodSite$PogoCachedMethodSiteNoUnwrapNoCoerce.invoke(PogoMetaMethodSite.java:198)
	at org.codehaus.groovy.runtime.callsite.PogoMetaMethodSite.callCurrent(PogoMetaMethodSite.java:62)
	at org.codehaus.groovy.runtime.callsite.AbstractCallSite.callCurrent(AbstractCallSite.java:185)
	at org.codehaus.groovy.runtime.callsite.AbstractCallSite.callCurrent(AbstractCallSite.java:183)
	at io.restassured.internal.ResponseSpecificationImpl.statusCode(ResponseSpecificationImpl.groovy:135)
	at io.restassured.specification.ResponseSpecification$statusCode$3.callCurrent(Unknown Source)
	at org.codehaus.groovy.runtime.callsite.CallSiteArray.defaultCallCurrent(CallSiteArray.java:49)
	at org.codehaus.groovy.runtime.callsite.AbstractCallSite.callCurrent(AbstractCallSite.java:171)
	at org.codehaus.groovy.runtime.callsite.AbstractCallSite.callCurrent(AbstractCallSite.java:185)
	at io.restassured.internal.ResponseSpecificationImpl.statusCode(ResponseSpecificationImpl.groovy:143)
	at io.restassured.internal.ValidatableResponseOptionsImpl.statusCode(ValidatableResponseOptionsImpl.java:89)
	at steps.api.plants.PlantSteps.verifyStatusCodeIs(PlantSteps.java:123)
	at ?.Verify status code is 201(file:///D:/uni/sem%207/IS%203440%20-%20Group%20Assignment/IS%203440%20-%20Group%20Assignment/Automation/ITFac_Batch21_Group58/src/test/resources/features/api/plants/plants_api.feature:11)

[INFO] Running starter.CucumberTestSuite
[INFO] Running io.cucumber.junit.platform.engine.CucumberTestEngine
16:00:58.909 [ForkJoinPool-2-worker-1] INFO  n.t.m.logging.ConsoleLoggingListener - 

-------------------------------------------------------------------------------------
     _______. _______ .______       _______ .__   __.  __  .___________.____    ____ 
    /       ||   ____||   _  \     |   ____||  \ |  | |  | |           |\   \  /   / 
   |   (----`|  |__   |  |_)  |    |  |__   |   \|  | |  | `---|  |----` \   \/   /  
    \   \    |   __|  |      /     |   __|  |  . `  | |  |     |  |       \_    _/   
.----)   |   |  |____ |  |\  \----.|  |____ |  |\   | |  |     |  |         |  |     
|_______/    |_______|| _| `._____||_______||__| \__| |__|     |__|         |__|    
                                                                                     
 News and tutorials at https://serenity-bdd.info                                     
 Documentation at https://serenity-bdd.github.io                                     
 Test Automation Training and Coaching: https://www.serenity-dojo.com                
 Commercial Support: https://www.serenity-dojo.com/serenity-bdd-enterprise-support   
 Join the Serenity Community on Gitter: https://gitter.im/serenity-bdd/serenity-core 
-------------------------------------------------------------------------------------

16:00:58.913 [ForkJoinPool-2-worker-1] INFO  n.t.m.logging.ConsoleLoggingListener - Test Suite Started: Plant Management API

@admin_auth
Scenario: PM2_API_A_05 Edit Plant                                                     # src/test/resources/features/api/plants/plants_api.feature:39
  ? Given the admin has a valid session                                               # steps.api.sales.SalesSteps.theAdminHasAValidSession()

@admin_auth
Scenario: PM2_API_A_02 Add Plant with Missing Name            # src/test/resources/features/api/plants/plants_api.feature:15
  ? And Valid plant ID exists                                                         # steps.api.plants.PlantSteps.validPlantIDExists()

@admin_auth
Scenario: PM2_API_A_01 Add New Plant (Valid Data)                               # src/test/resources/features/api/plants/plants_api.feature:7
  ? When Send PUT request to /api/plants/{validId} with updated Name, Price, Quantity # steps.api.plants.PlantSteps.sendPUTRequestToUpdatePlant()
  ? Then Verify HTTP status code is 200                                               # steps.api.plants.PlantSteps.verifyHTTPStatusCodeIs(int)
        java.lang.AssertionError: 1 expectation failed.
        Expected status code <200> but was <404>.
        
        	at java.base/jdk.internal.reflect.DirectConstructorHandleAccessor.newInstance(DirectConstructorHandleAccessor.java:62)
        	at java.base/java.lang.reflect.Constructor.newInstanceWithCaller(Constructor.java:502)
        	at java.base/java.lang.reflect.Constructor.newInstance(Constructor.java:486)
        	at org.codehaus.groovy.reflection.CachedConstructor.invoke(CachedConstructor.java:73)
        	at org.codehaus.groovy.reflection.CachedConstructor.doConstructorInvoke(CachedConstructor.java:60)
        	at org.codehaus.groovy.runtime.callsite.ConstructorSite$ConstructorSiteNoUnwrap.callConstructor(ConstructorSite.java:86)
        	at org.codehaus.groovy.runtime.callsite.AbstractCallSite.callConstructor(AbstractCallSite.java:277)
        	at io.restassured.internal.ResponseSpecificationImpl$HamcrestAssertionClosure.validate(ResponseSpecificationImpl.groovy:512)
        	at io.restassured.internal.ResponseSpecificationImpl$HamcrestAssertionClosure$validate$9.call(Unknown Source)
        	at io.restassured.internal.ResponseSpecificationImpl.validateResponseIfRequired(ResponseSpecificationImpl.groovy:696)
        	at io.restassured.internal.ResponseSpecificationImpl.this$2$validateResponseIfRequired(ResponseSpecificationImpl.groovy)
        	at java.base/jdk.internal.reflect.DirectMethodHandleAccessor.invoke(DirectMethodHandleAccessor.java:103)
        	at java.base/java.lang.reflect.Method.invoke(Method.java:580)
        	at org.codehaus.groovy.runtime.callsite.PlainObjectMetaMethodSite.doInvoke(PlainObjectMetaMethodSite.java:43)
        	at org.codehaus.groovy.runtime.callsite.PogoMetaMethodSite$PogoCachedMethodSiteNoUnwrapNoCoerce.invoke(PogoMetaMethodSite.java:198)
        	at org.codehaus.groovy.runtime.callsite.PogoMetaMethodSite.callCurrent(PogoMetaMethodSite.java:62)
        	at org.codehaus.groovy.runtime.callsite.AbstractCallSite.callCurrent(AbstractCallSite.java:185)
        	at io.restassured.internal.ResponseSpecificationImpl.statusCode(ResponseSpecificationImpl.groovy:135)
        	at io.restassured.specification.ResponseSpecification$statusCode$4.callCurrent(Unknown Source)
        	at io.restassured.internal.ResponseSpecificationImpl.statusCode(ResponseSpecificationImpl.groovy:143)
        	at io.restassured.internal.ValidatableResponseOptionsImpl.statusCode(ValidatableResponseOptionsImpl.java:89)
        	at steps.api.plants.PlantSteps.verifyHTTPStatusCodeIs(PlantSteps.java:128)
        	at ?.Verify HTTP status code is 200(file:///D:/uni/sem%207/IS%203440%20-%20Group%20Assignment/IS%203440%20-%20Group%20Assignment/Automation/ITFac_Batch21_Group58/src/test/resources/features/api/plants/plants_api.feature:43)
  ? And API returns 200 OK                                                            # steps.api.plants.PlantSteps.apiReturns200OK()

@admin_auth
Scenario: PM2_API_A_04 Add Plant with Price Invalid   # src/test/resources/features/api/plants/plants_api.feature:31

@admin_auth
Scenario: PM2_API_A_03 Add Plant with Invalid Category              # src/test/resources/features/api/plants/plants_api.feature:23
  ? Given the admin has a valid session                       # steps.api.sales.SalesSteps.theAdminHasAValidSession()
  ? And Valid sub-category exists                             # steps.api.plants.PlantSteps.validSubCategoryExists()
  ? When Send POST request with JSON body missing Name        # steps.api.plants.PlantSteps.sendPOSTRequestWithMissingName()
  ? Then Verify status code is 400                            # steps.api.plants.PlantSteps.verifyStatusCodeIs(int)
  ? And API returns validation error and plant is not created # steps.api.plants.PlantSteps.apiReturnsValidationErrorAndPlantIsNotCreated()
  ? Given the admin has a valid session                                         # steps.api.sales.SalesSteps.theAdminHasAValidSession()
  ? And Valid sub-category exists                                               # steps.api.plants.PlantSteps.validSubCategoryExists()
  ? When Send POST request with valid Name, Price, Quantity to valid category 3 # steps.api.plants.PlantSteps.sendPOSTRequestWithValidDataToCategory(int)
  ? Given the admin has a valid session               # steps.api.sales.SalesSteps.theAdminHasAValidSession()
  ? Then Verify status code is 201                                              # steps.api.plants.PlantSteps.verifyStatusCodeIs(int)
        java.lang.AssertionError: 1 expectation failed.
        Expected status code <201> but was <400>.
        
        	at java.base/jdk.internal.reflect.DirectConstructorHandleAccessor.newInstance(DirectConstructorHandleAccessor.java:62)
        	at java.base/java.lang.reflect.Constructor.newInstanceWithCaller(Constructor.java:502)
        	at java.base/java.lang.reflect.Constructor.newInstance(Constructor.java:486)
        	at org.codehaus.groovy.reflection.CachedConstructor.invoke(CachedConstructor.java:73)
        	at org.codehaus.groovy.reflection.CachedConstructor.doConstructorInvoke(CachedConstructor.java:60)
        	at org.codehaus.groovy.runtime.callsite.ConstructorSite$ConstructorSiteNoUnwrap.callConstructor(ConstructorSite.java:86)
        	at org.codehaus.groovy.runtime.callsite.AbstractCallSite.callConstructor(AbstractCallSite.java:277)
        	at io.restassured.internal.ResponseSpecificationImpl$HamcrestAssertionClosure.validate(ResponseSpecificationImpl.groovy:512)
        	at io.restassured.internal.ResponseSpecificationImpl$HamcrestAssertionClosure$validate$9.call(Unknown Source)
        	at io.restassured.internal.ResponseSpecificationImpl.validateResponseIfRequired(ResponseSpecificationImpl.groovy:696)
        	at io.restassured.internal.ResponseSpecificationImpl.this$2$validateResponseIfRequired(ResponseSpecificationImpl.groovy)
        	at java.base/jdk.internal.reflect.DirectMethodHandleAccessor.invoke(DirectMethodHandleAccessor.java:103)
        	at java.base/java.lang.reflect.Method.invoke(Method.java:580)
        	at org.codehaus.groovy.runtime.callsite.PlainObjectMetaMethodSite.doInvoke(PlainObjectMetaMethodSite.java:43)
        	at org.codehaus.groovy.runtime.callsite.PogoMetaMethodSite$PogoCachedMethodSiteNoUnwrapNoCoerce.invoke(PogoMetaMethodSite.java:198)
        	at org.codehaus.groovy.runtime.callsite.PogoMetaMethodSite.callCurrent(PogoMetaMethodSite.java:62)
        	at org.codehaus.groovy.runtime.callsite.AbstractCallSite.callCurrent(AbstractCallSite.java:185)
        	at io.restassured.internal.ResponseSpecificationImpl.statusCode(ResponseSpecificationImpl.groovy:135)
        	at io.restassured.specification.ResponseSpecification$statusCode$4.callCurrent(Unknown Source)
        	at io.restassured.internal.ResponseSpecificationImpl.statusCode(ResponseSpecificationImpl.groovy:143)
        	at io.restassured.internal.ValidatableResponseOptionsImpl.statusCode(ValidatableResponseOptionsImpl.java:89)
        	at steps.api.plants.PlantSteps.verifyStatusCodeIs(PlantSteps.java:123)
        	at ?.Verify status code is 201(file:///D:/uni/sem%207/IS%203440%20-%20Group%20Assignment/IS%203440%20-%20Group%20Assignment/Automation/ITFac_Batch21_Group58/src/test/resources/features/api/plants/plants_api.feature:11)
  ? And API returns success and plant is created                                # steps.api.plants.PlantSteps.apiReturnsSuccessAndPlantIsCreated()
  ? And Valid sub-category exists                     # steps.api.plants.PlantSteps.validSubCategoryExists()
  ? Given the admin has a valid session                             # steps.api.sales.SalesSteps.theAdminHasAValidSession()
  ? And Valid sub-category exists                                   # steps.api.plants.PlantSteps.validSubCategoryExists()
  ? When Send POST request with Price = 0 or negative # steps.api.plants.PlantSteps.sendPOSTRequestWithInvalidPrice()
  ? Then Verify HTTP status code is 400               # steps.api.plants.PlantSteps.verifyHTTPStatusCodeIs(int)
  ? And API returns 400 Bad Request                   # steps.api.plants.PlantSteps.apiReturns400BadRequest()
  ? When Send POST request with category that is not a sub-category # steps.api.plants.PlantSteps.sendPOSTRequestWithInvalidCategory()
  ? Then Verify status code is 400                                  # steps.api.plants.PlantSteps.verifyStatusCodeIs(int)
        java.lang.AssertionError: 1 expectation failed.
        Expected status code <400> but was <404>.
        
        	at java.base/jdk.internal.reflect.DirectConstructorHandleAccessor.newInstance(DirectConstructorHandleAccessor.java:62)
        	at java.base/java.lang.reflect.Constructor.newInstanceWithCaller(Constructor.java:502)
        	at java.base/java.lang.reflect.Constructor.newInstance(Constructor.java:486)
        	at org.codehaus.groovy.reflection.CachedConstructor.invoke(CachedConstructor.java:73)
        	at org.codehaus.groovy.reflection.CachedConstructor.doConstructorInvoke(CachedConstructor.java:60)
        	at org.codehaus.groovy.runtime.callsite.ConstructorSite$ConstructorSiteNoUnwrap.callConstructor(ConstructorSite.java:86)
        	at org.codehaus.groovy.runtime.callsite.AbstractCallSite.callConstructor(AbstractCallSite.java:277)
        	at io.restassured.internal.ResponseSpecificationImpl$HamcrestAssertionClosure.validate(ResponseSpecificationImpl.groovy:512)
        	at io.restassured.internal.ResponseSpecificationImpl$HamcrestAssertionClosure$validate$9.call(Unknown Source)
        	at io.restassured.internal.ResponseSpecificationImpl.validateResponseIfRequired(ResponseSpecificationImpl.groovy:696)
        	at io.restassured.internal.ResponseSpecificationImpl.this$2$validateResponseIfRequired(ResponseSpecificationImpl.groovy)
        	at java.base/jdk.internal.reflect.DirectMethodHandleAccessor.invoke(DirectMethodHandleAccessor.java:103)
        	at java.base/java.lang.reflect.Method.invoke(Method.java:580)
        	at org.codehaus.groovy.runtime.callsite.PlainObjectMetaMethodSite.doInvoke(PlainObjectMetaMethodSite.java:43)
        	at org.codehaus.groovy.runtime.callsite.PogoMetaMethodSite$PogoCachedMethodSiteNoUnwrapNoCoerce.invoke(PogoMetaMethodSite.java:198)
        	at org.codehaus.groovy.runtime.callsite.PogoMetaMethodSite.callCurrent(PogoMetaMethodSite.java:62)
        	at org.codehaus.groovy.runtime.callsite.AbstractCallSite.callCurrent(AbstractCallSite.java:185)
        	at io.restassured.internal.ResponseSpecificationImpl.statusCode(ResponseSpecificationImpl.groovy:135)
        	at io.restassured.specification.ResponseSpecification$statusCode$4.callCurrent(Unknown Source)
        	at io.restassured.internal.ResponseSpecificationImpl.statusCode(ResponseSpecificationImpl.groovy:143)
        	at io.restassured.internal.ValidatableResponseOptionsImpl.statusCode(ValidatableResponseOptionsImpl.java:89)
        	at steps.api.plants.PlantSteps.verifyStatusCodeIs(PlantSteps.java:123)
        	at ?.Verify status code is 400(file:///D:/uni/sem%207/IS%203440%20-%20Group%20Assignment/IS%203440%20-%20Group%20Assignment/Automation/ITFac_Batch21_Group58/src/test/resources/features/api/plants/plants_api.feature:27)
  ? And API returns validation error and plant is not created       # steps.api.plants.PlantSteps.apiReturnsValidationErrorAndPlantIsNotCreated()
16:00:59.708 [ForkJoinPool-2-worker-1] INFO  n.t.m.logging.ConsoleLoggingListener - 
  _____   ___   ___   _____     ___   _____     _     ___   _____   ___   ___  
 |_   _| | __| / __| |_   _|   / __| |_   _|   /_\   | _ \ |_   _| | __| |   \ 
   | |   | _|  \__ \   | |     \__ \   | |    / _ \  |   /   | |   | _|  | |) |
   |_|   |___| |___/   |_|     |___/   |_|   /_/ \_\ |_|_\   |_|   |___| |___/ 

PM2_API_A_01 Add New Plant (Valid Data)(plant-management-api;pm2-api-a-01-add-new-plant-(valid-data))
--------------------------------------------------------------------------------
16:00:59.731 [ForkJoinPool-2-worker-1] INFO  n.t.m.logging.ConsoleLoggingListener - 
  _____   ___   ___   _____     ___   _____     _     ___   _____   ___   ___  
 |_   _| | __| / __| |_   _|   / __| |_   _|   /_\   | _ \ |_   _| | __| |   \ 
   | |   | _|  \__ \   | |     \__ \   | |    / _ \  |   /   | |   | _|  | |) |
   |_|   |___| |___/   |_|     |___/   |_|   /_/ \_\ |_|_\   |_|   |___| |___/ 

PM2_API_A_02 Add Plant with Missing Name(plant-management-api;pm2-api-a-02-add-plant-with-missing-name)
--------------------------------------------------------------------------------
16:00:59.731 [ForkJoinPool-2-worker-1] INFO  n.t.m.logging.ConsoleLoggingListener - 
  _____   ___   ___   _____     ___     _     ___   ___   ___   ___  
 |_   _| | __| / __| |_   _|   | _ \   /_\   / __| / __| | __| |   \ 
   | |   | _|  \__ \   | |     |  _/  / _ \  \__ \ \__ \ | _|  | |) |
   |_|   |___| |___/   |_|     |_|   /_/ \_\ |___/ |___/ |___| |___/ 

PM2_API_A_02 Add Plant with Missing Name
----------------------------------------------------------------------
16:00:59.754 [ForkJoinPool-2-worker-1] INFO  n.t.m.logging.ConsoleLoggingListener - 
  _____   ___   ___   _____     ___   _____     _     ___   _____   ___   ___  
 |_   _| | __| / __| |_   _|   / __| |_   _|   /_\   | _ \ |_   _| | __| |   \ 
   | |   | _|  \__ \   | |     \__ \   | |    / _ \  |   /   | |   | _|  | |) |
   |_|   |___| |___/   |_|     |___/   |_|   /_/ \_\ |_|_\   |_|   |___| |___/ 

PM2_API_A_03 Add Plant with Invalid Category(plant-management-api;pm2-api-a-03-add-plant-with-invalid-category)
--------------------------------------------------------------------------------
16:00:59.760 [ForkJoinPool-2-worker-1] INFO  n.t.m.logging.ConsoleLoggingListener - 
  _____   ___   ___   _____     ___   _____     _     ___   _____   ___   ___  
 |_   _| | __| / __| |_   _|   / __| |_   _|   /_\   | _ \ |_   _| | __| |   \ 
   | |   | _|  \__ \   | |     \__ \   | |    / _ \  |   /   | |   | _|  | |) |
   |_|   |___| |___/   |_|     |___/   |_|   /_/ \_\ |_|_\   |_|   |___| |___/ 

PM2_API_A_04 Add Plant with Price Invalid(plant-management-api;pm2-api-a-04-add-plant-with-price-invalid)
--------------------------------------------------------------------------------
16:00:59.762 [ForkJoinPool-2-worker-1] INFO  n.t.m.logging.ConsoleLoggingListener - 
  _____   ___   ___   _____     ___     _     ___   ___   ___   ___  
 |_   _| | __| / __| |_   _|   | _ \   /_\   / __| / __| | __| |   \ 
   | |   | _|  \__ \   | |     |  _/  / _ \  \__ \ \__ \ | _|  | |) |
   |_|   |___| |___/   |_|     |_|   /_/ \_\ |___/ |___/ |___| |___/ 

PM2_API_A_04 Add Plant with Price Invalid
----------------------------------------------------------------------
16:00:59.780 [ForkJoinPool-2-worker-1] INFO  n.t.m.logging.ConsoleLoggingListener - 
  _____   ___   ___   _____     ___   _____     _     ___   _____   ___   ___  
 |_   _| | __| / __| |_   _|   / __| |_   _|   /_\   | _ \ |_   _| | __| |   \ 
   | |   | _|  \__ \   | |     \__ \   | |    / _ \  |   /   | |   | _|  | |) |
   |_|   |___| |___/   |_|     |___/   |_|   /_/ \_\ |_|_\   |_|   |___| |___/ 

PM2_API_A_05 Edit Plant(plant-management-api;pm2-api-a-05-edit-plant)
--------------------------------------------------------------------------------
Feb 06, 2026 4:01:00 PM org.junit.platform.launcher.core.DiscoveryIssueNotifier logIssues
WARNING: TestEngine with ID 'cucumber' encountered a non-critical issue during test discovery:

(1) [WARNING] Discovering tests using the cucumber.features property. Other discovery selectors are ignored!

This is a work around for the limited JUnit 5 support in Maven and Gradle. Please request/upvote/sponsor/ect better support for JUnit 5 discovery selectors. For details see: https://github.com/cucumber/cucumber-jvm/pull/2498

If you are using the JUnit 5 Suite Engine, Platform Launcher API or Console Launcher you should not use this property. Please consult the JUnit 5 documentation on test selection.
[ERROR] Tests run: 5, Failures: 3, Errors: 0, Skipped: 0, Time elapsed: 1.279 s <<< FAILURE! -- in io.cucumber.junit.platform.engine.CucumberTestEngine
[ERROR] Plant Management API.PM2_API_A_05 Edit Plant -- Time elapsed: 0.404 s <<< FAILURE!
java.lang.AssertionError: 
1 expectation failed.
Expected status code <200> but was <404>.

	at java.base/java.lang.reflect.Constructor.newInstanceWithCaller(Constructor.java:502)
	at java.base/java.lang.reflect.Constructor.newInstance(Constructor.java:486)
	at org.codehaus.groovy.reflection.CachedConstructor.invoke(CachedConstructor.java:73)
	at org.codehaus.groovy.reflection.CachedConstructor.doConstructorInvoke(CachedConstructor.java:60)
	at org.codehaus.groovy.runtime.callsite.ConstructorSite$ConstructorSiteNoUnwrap.callConstructor(ConstructorSite.java:86)
	at org.codehaus.groovy.runtime.callsite.AbstractCallSite.callConstructor(AbstractCallSite.java:277)
	at io.restassured.internal.ResponseSpecificationImpl$HamcrestAssertionClosure.validate(ResponseSpecificationImpl.groovy:512)
	at io.restassured.internal.ResponseSpecificationImpl$HamcrestAssertionClosure$validate$9.call(Unknown Source)
	at io.restassured.internal.ResponseSpecificationImpl.validateResponseIfRequired(ResponseSpecificationImpl.groovy:696)
	at io.restassured.internal.ResponseSpecificationImpl.this$2$validateResponseIfRequired(ResponseSpecificationImpl.groovy)
	at java.base/java.lang.reflect.Method.invoke(Method.java:580)
	at org.codehaus.groovy.runtime.callsite.PlainObjectMetaMethodSite.doInvoke(PlainObjectMetaMethodSite.java:43)
	at org.codehaus.groovy.runtime.callsite.PogoMetaMethodSite$PogoCachedMethodSiteNoUnwrapNoCoerce.invoke(PogoMetaMethodSite.java:198)
	at org.codehaus.groovy.runtime.callsite.PogoMetaMethodSite.callCurrent(PogoMetaMethodSite.java:62)
	at org.codehaus.groovy.runtime.callsite.AbstractCallSite.callCurrent(AbstractCallSite.java:185)
	at io.restassured.internal.ResponseSpecificationImpl.statusCode(ResponseSpecificationImpl.groovy:135)
	at io.restassured.specification.ResponseSpecification$statusCode$4.callCurrent(Unknown Source)
	at io.restassured.internal.ResponseSpecificationImpl.statusCode(ResponseSpecificationImpl.groovy:143)
	at io.restassured.internal.ValidatableResponseOptionsImpl.statusCode(ValidatableResponseOptionsImpl.java:89)
	at steps.api.plants.PlantSteps.verifyHTTPStatusCodeIs(PlantSteps.java:128)
	at ?.Verify HTTP status code is 200(file:///D:/uni/sem%207/IS%203440%20-%20Group%20Assignment/IS%203440%20-%20Group%20Assignment/Automation/ITFac_Batch21_Group58/src/test/resources/features/api/plants/plants_api.feature:43)

[ERROR] Plant Management API.PM2_API_A_01 Add New Plant (Valid Data) -- Time elapsed: 0.637 s <<< FAILURE!
java.lang.AssertionError: 
1 expectation failed.
Expected status code <201> but was <400>.

	at java.base/java.lang.reflect.Constructor.newInstanceWithCaller(Constructor.java:502)
	at java.base/java.lang.reflect.Constructor.newInstance(Constructor.java:486)
	at org.codehaus.groovy.reflection.CachedConstructor.invoke(CachedConstructor.java:73)
	at org.codehaus.groovy.reflection.CachedConstructor.doConstructorInvoke(CachedConstructor.java:60)
	at org.codehaus.groovy.runtime.callsite.ConstructorSite$ConstructorSiteNoUnwrap.callConstructor(ConstructorSite.java:86)
	at org.codehaus.groovy.runtime.callsite.AbstractCallSite.callConstructor(AbstractCallSite.java:277)
	at io.restassured.internal.ResponseSpecificationImpl$HamcrestAssertionClosure.validate(ResponseSpecificationImpl.groovy:512)
	at io.restassured.internal.ResponseSpecificationImpl$HamcrestAssertionClosure$validate$9.call(Unknown Source)
	at io.restassured.internal.ResponseSpecificationImpl.validateResponseIfRequired(ResponseSpecificationImpl.groovy:696)
	at io.restassured.internal.ResponseSpecificationImpl.this$2$validateResponseIfRequired(ResponseSpecificationImpl.groovy)
	at java.base/java.lang.reflect.Method.invoke(Method.java:580)
	at org.codehaus.groovy.runtime.callsite.PlainObjectMetaMethodSite.doInvoke(PlainObjectMetaMethodSite.java:43)
	at org.codehaus.groovy.runtime.callsite.PogoMetaMethodSite$PogoCachedMethodSiteNoUnwrapNoCoerce.invoke(PogoMetaMethodSite.java:198)
	at org.codehaus.groovy.runtime.callsite.PogoMetaMethodSite.callCurrent(PogoMetaMethodSite.java:62)
	at org.codehaus.groovy.runtime.callsite.AbstractCallSite.callCurrent(AbstractCallSite.java:185)
	at io.restassured.internal.ResponseSpecificationImpl.statusCode(ResponseSpecificationImpl.groovy:135)
	at io.restassured.specification.ResponseSpecification$statusCode$4.callCurrent(Unknown Source)
	at io.restassured.internal.ResponseSpecificationImpl.statusCode(ResponseSpecificationImpl.groovy:143)
	at io.restassured.internal.ValidatableResponseOptionsImpl.statusCode(ValidatableResponseOptionsImpl.java:89)
	at steps.api.plants.PlantSteps.verifyStatusCodeIs(PlantSteps.java:123)
	at ?.Verify status code is 201(file:///D:/uni/sem%207/IS%203440%20-%20Group%20Assignment/IS%203440%20-%20Group%20Assignment/Automation/ITFac_Batch21_Group58/src/test/resources/features/api/plants/plants_api.feature:11)

[ERROR] Plant Management API.PM2_API_A_03 Add Plant with Invalid Category -- Time elapsed: 0.716 s <<< FAILURE!
java.lang.AssertionError: 
1 expectation failed.
Expected status code <400> but was <404>.

	at java.base/java.lang.reflect.Constructor.newInstanceWithCaller(Constructor.java:502)
	at java.base/java.lang.reflect.Constructor.newInstance(Constructor.java:486)
	at org.codehaus.groovy.reflection.CachedConstructor.invoke(CachedConstructor.java:73)
	at org.codehaus.groovy.reflection.CachedConstructor.doConstructorInvoke(CachedConstructor.java:60)
	at org.codehaus.groovy.runtime.callsite.ConstructorSite$ConstructorSiteNoUnwrap.callConstructor(ConstructorSite.java:86)
	at org.codehaus.groovy.runtime.callsite.AbstractCallSite.callConstructor(AbstractCallSite.java:277)
	at io.restassured.internal.ResponseSpecificationImpl$HamcrestAssertionClosure.validate(ResponseSpecificationImpl.groovy:512)
	at io.restassured.internal.ResponseSpecificationImpl$HamcrestAssertionClosure$validate$9.call(Unknown Source)
	at io.restassured.internal.ResponseSpecificationImpl.validateResponseIfRequired(ResponseSpecificationImpl.groovy:696)
	at io.restassured.internal.ResponseSpecificationImpl.this$2$validateResponseIfRequired(ResponseSpecificationImpl.groovy)
	at java.base/java.lang.reflect.Method.invoke(Method.java:580)
	at org.codehaus.groovy.runtime.callsite.PlainObjectMetaMethodSite.doInvoke(PlainObjectMetaMethodSite.java:43)
	at org.codehaus.groovy.runtime.callsite.PogoMetaMethodSite$PogoCachedMethodSiteNoUnwrapNoCoerce.invoke(PogoMetaMethodSite.java:198)
	at org.codehaus.groovy.runtime.callsite.PogoMetaMethodSite.callCurrent(PogoMetaMethodSite.java:62)
	at org.codehaus.groovy.runtime.callsite.AbstractCallSite.callCurrent(AbstractCallSite.java:185)
	at io.restassured.internal.ResponseSpecificationImpl.statusCode(ResponseSpecificationImpl.groovy:135)
	at io.restassured.specification.ResponseSpecification$statusCode$4.callCurrent(Unknown Source)
	at io.restassured.internal.ResponseSpecificationImpl.statusCode(ResponseSpecificationImpl.groovy:143)
	at io.restassured.internal.ValidatableResponseOptionsImpl.statusCode(ValidatableResponseOptionsImpl.java:89)
	at steps.api.plants.PlantSteps.verifyStatusCodeIs(PlantSteps.java:123)
	at ?.Verify status code is 400(file:///D:/uni/sem%207/IS%203440%20-%20Group%20Assignment/IS%203440%20-%20Group%20Assignment/Automation/ITFac_Batch21_Group58/src/test/resources/features/api/plants/plants_api.feature:27)

[INFO] Tests run: 0, Failures: 0, Errors: 0, Skipped: 0, Time elapsed: 1.481 s -- in starter.CucumberTestSuite
Feb 06, 2026 4:01:00 PM org.junit.platform.launcher.core.DiscoveryIssueNotifier logIssues
WARNING: TestEngine with ID 'junit-platform-suite' encountered a non-critical issue during test discovery:

(1) [WARNING] [cucumber] Discovering tests using the cucumber.features property. Other discovery selectors are ignored!

This is a work around for the limited JUnit 5 support in Maven and Gradle. Please request/upvote/sponsor/ect better support for JUnit 5 discovery selectors. For details see: https://github.com/cucumber/cucumber-jvm/pull/2498

If you are using the JUnit 5 Suite Engine, Platform Launcher API or Console Launcher you should not use this property. Please consult the JUnit 5 documentation on test selection (via @Suite starter.CucumberTestSuite).
[INFO] 
[INFO] Results:
[INFO] 
[ERROR] Failures: 
[ERROR] Plant Management API.PM2_API_A_01 Add New Plant (Valid Data)
[ERROR]   Run 1: 1 expectation failed.
Expected status code <201> but was <400>.

[ERROR]   Run 2: 1 expectation failed.
Expected status code <201> but was <400>.

[INFO] 
[ERROR] Plant Management API.PM2_API_A_03 Add Plant with Invalid Category
[ERROR]   Run 1: 1 expectation failed.
Expected status code <400> but was <404>.

[ERROR]   Run 2: 1 expectation failed.
Expected status code <400> but was <404>.

[INFO] 
[ERROR] Plant Management API.PM2_API_A_05 Edit Plant
[ERROR]   Run 1: 1 expectation failed.
Expected status code <200> but was <404>.

[ERROR]   Run 2: 1 expectation failed.
Expected status code <200> but was <404>.

[INFO] 
[INFO] 
[ERROR] Tests run: 7, Failures: 3, Errors: 0, Skipped: 0
[INFO] 
[INFO] 
[INFO] --- serenity:5.0.4:aggregate (serenity-reports) @ cucumber-starter ---
[INFO] GENERATING REPORTS FOR: D:\uni\sem 7\IS 3440 - Group Assignment\IS 3440 - Group Assignment\Automation\ITFac_Batch21_Group58
[INFO] GENERATING REPORTS USING 16 THREADS
[INFO] 
[INFO] ------------------------------------------------------------------------
[INFO] Serenity BDD Test Results
[INFO]   - Report guide: https://serenity-bdd.github.io
[INFO]   - Results: 5 tests | 2 passed | 3 failed | 0 errors | 0 compromised | 0 pending | 0 aborted
[INFO]   - Issues detected:
[INFO]     - Failed      : 3
[INFO] ------------------------------------------------------------------------
[INFO] 
[INFO] Generating Serenity BDD Reports
[INFO]   ? Summary reports
[INFO]   ? Requirements reports
[INFO]   ? Result reports
[INFO]   ? Error reports
[INFO] 
[INFO] Reports generated in 2 secs
[INFO] 
[INFO] ? Interactive Report: file:///D:/uni/sem%207/IS%203440%20-%20Group%20Assignment/IS%203440%20-%20Group%20Assignment/Automation/ITFac_Batch21_Group58/target/site/serenity/index.html
[INFO] ? Single Page HTML Summary: file:///D:/uni/sem%207/IS%203440%20-%20Group%20Assignment/IS%203440%20-%20Group%20Assignment/Automation/ITFac_Batch21_Group58/target/site/serenity/serenity-summary.html
[INFO] 
[INFO] --- failsafe:3.1.2:verify (default) @ cucumber-starter ---
[WARNING]  Parameter 'encoding' (user property 'encoding') is deprecated: since of 2.20.1
[INFO] ------------------------------------------------------------------------
[INFO] BUILD FAILURE
[INFO] ------------------------------------------------------------------------
[INFO] Total time:  18.684 s
[INFO] Finished at: 2026-02-06T16:01:04+05:30
[INFO] ------------------------------------------------------------------------
[ERROR] Failed to execute goal org.apache.maven.plugins:maven-failsafe-plugin:3.1.2:verify (default) on project cucumber-starter: There are test failures.
[ERROR] 
[ERROR] Please refer to D:\uni\sem 7\IS 3440 - Group Assignment\IS 3440 - Group Assignment\Automation\ITFac_Batch21_Group58\target\failsafe-reports for the individual test results.
[ERROR] Please refer to dump files (if any exist) [date].dump, [date]-jvmRun[N].dump and [date].dumpstream.
[ERROR] -> [Help 1]
[ERROR] 
[ERROR] To see the full stack trace of the errors, re-run Maven with the -e switch.
[ERROR] Re-run Maven using the -X switch to enable full debug logging.
[ERROR] 
[ERROR] For more information about the errors and possible solutions, please read the following articles:
[ERROR] [Help 1] http://cwiki.apache.org/confluence/display/MAVEN/MojoFailureException
