[INFO] Scanning for projects...
[INFO] 
[INFO] --------------< net.serenitybdd.starter:cucumber-starter >--------------
[INFO] Building Sample Serenity BDD project using Cucumber 1.0.0-SNAPSHOT
[INFO]   from pom.xml
[INFO] --------------------------------[ jar ]---------------------------------
[INFO] 
[INFO] --- clean:3.2.0:clean (default-clean) @ cucumber-starter ---
[INFO] Deleting D:\L4S1\ITQA\ITFac_Batch21_Group58\target
[INFO] 
[INFO] --- resources:3.3.1:resources (default-resources) @ cucumber-starter ---
[INFO] skip non existing resourceDirectory D:\L4S1\ITQA\ITFac_Batch21_Group58\src\main\resources
[INFO] 
[INFO] --- compiler:3.8.1:compile (default-compile) @ cucumber-starter ---
[INFO] Nothing to compile - all classes are up to date
[INFO] 
[INFO] --- resources:3.3.1:testResources (default-testResources) @ cucumber-starter ---
[INFO] Copying 5 resources from src\test\resources to target\test-classes
[INFO] 
[INFO] --- compiler:3.8.1:testCompile (default-testCompile) @ cucumber-starter ---
[INFO] Changes detected - recompiling the module!
[INFO] Compiling 24 source files to D:\L4S1\ITQA\ITFac_Batch21_Group58\target\test-classes
[INFO] 
[INFO] --- surefire:3.1.2:test (default-test) @ cucumber-starter ---
[INFO] Tests are skipped.
[INFO] 
[INFO] --- jar:3.3.0:jar (default-jar) @ cucumber-starter ---
[WARNING] JAR will be empty - no content was marked for inclusion!
[INFO] Building jar: D:\L4S1\ITQA\ITFac_Batch21_Group58\target\cucumber-starter-1.0.0-SNAPSHOT.jar
[INFO] 
[INFO] --- failsafe:3.1.2:integration-test (default) @ cucumber-starter ---
[INFO] Using auto detected provider org.apache.maven.surefire.junitplatform.JUnitPlatformProvider
[INFO] 
[INFO] -------------------------------------------------------
[INFO]  T E S T S
[INFO] -------------------------------------------------------
mvn : Feb 06, 2026 4:29:29 AM 
org.junit.platform.launcher.core.DiscoveryIssueNotifier 
logIssues
At line:1 char:1
+ mvn clean verify -Dtags="@category_api" > 
test_output_11.txt 2>&1
+ ~~~~~~~~~~~~~~~~~~~~~~~~~~~~~~~~~~~~~~~~~~~~~~~~~~~~~~
~~~~~~~~~~~
    + CategoryInfo          : NotSpecified: (Feb 06, 20 
   26 4:...ifier logIssues:String) [], RemoteException
    + FullyQualifiedErrorId : NativeCommandError
 
WARNING: TestEngine with ID 'junit-platform-suite' 
encountered a non-critical issue during test discovery:

(1) [WARNING] [cucumber] The classpath resource 
selector 'features' should not be used to select 
features in a package. Use the package selector with 
'features' instead (via @Suite 
starter.CucumberTestSuite).
[INFO] Running starter.CucumberTestSuite
04:29:30.659 [ForkJoinPool-2-worker-2] INFO  n.thucydides.core.steps.StepEventBus - Loading JUnit Platform configuration parameters from classpath resource [junit-platform.properties].
04:29:30.704 [ForkJoinPool-2-worker-2] INFO  n.t.m.logging.ConsoleLoggingListener - 

-------------------------------------------------------------------------------------
     _______. _______ .______       _______ .__   __.  __  .___________.____    ____ 
    /       ||   ____||   _  \     |   ____||  \ |  | |  | |           |\   \  /   / 
   |   (----`|  |__   |  |_)  |    |  |__   |   \|  | |  | `---|  |----` \   \/   /  
    \   \    |   __|  |      /     |   __|  |  . `  | |  |     |  |       \_    _/   
.----)   |   |  |____ |  |\  \----.|  |____ |  |\   | |  |     |  |         |  |     
|_______/    |_______|| _| `._____||_______||__| \__| |__|     |__|         |__|    
                                                                                     
 News and tutorials at https://serenity-bdd.info                                     
 Documentation at https://serenity-bdd.github.io                                     
 Test Automation Training and Coaching: https://www.serenity-dojo.com                
 Commercial Support: https://www.serenity-dojo.com/serenity-bdd-enterprise-support   
 Join the Serenity Community on Gitter: https://gitter.im/serenity-bdd/serenity-core 
-------------------------------------------------------------------------------------

04:29:30.715 [ForkJoinPool-2-worker-2] INFO  n.t.m.logging.ConsoleLoggingListener - Test Suite Started: Category Management API
04:29:30.780 [ForkJoinPool-2-worker-1] INFO  n.t.m.logging.ConsoleLoggingListener - Test Suite Started: Sales Management

@sales @login_as_admin
Scenario: SM_UI_A_03 Verify Sell Plant Button Visibility # classpath:features/ui/sales/manage_sales_orders.feature:17

@user_auth
Scenario: CM2_API_U_05 Reject Add Sub-Category via API (User)                # classpath:features/api/category/category_api.feature:80

@admin_auth
Scenario: CM2_API_A_01 Create Category via API Successfully                         # classpath:features/api/category/category_api.feature:7

@sales @login_as_admin
Scenario: SM_UI_A_01 View Sales List                          # classpath:features/ui/sales/manage_sales_orders.feature:7
04:29:31.922 [ForkJoinPool-2-worker-3] INFO  hooks.AuthenticationHooks - Hook: Logging in as Admin
04:29:31.930 [ForkJoinPool-2-worker-1] INFO  hooks.AuthenticationHooks - Hook: Logging in as Admin
04:29:32.073 [ForkJoinPool-2-worker-1] INFO  n.s.c.w.d.ChromeDriverProvider - Starting Chrome driver instance with capabilities:
04:29:32.073 [ForkJoinPool-2-worker-3] INFO  n.s.c.w.d.ChromeDriverProvider - Starting Chrome driver instance with capabilities:
04:29:32.076 [ForkJoinPool-2-worker-1] INFO  n.s.c.w.d.ChromeDriverProvider - Capabilities {acceptInsecureCerts: true, browserName: chrome, goog:chromeOptions: {args: [remote-allow-origins=*, test-type, no-sandbox, ignore-certificate-errors, --window-size=1000,800, incognito, disable-infobars, disable-gpu, disable-default-apps, disable-popup-blocking, disable-dev-shm-usage, disable-extensions, disable-web-security, disable-translate, disable-logging, remote-allow-origins=*, --headless=chrome, --headless], extensions: []}}
04:29:32.076 [ForkJoinPool-2-worker-3] INFO  n.s.c.w.d.ChromeDriverProvider - Capabilities {acceptInsecureCerts: true, browserName: chrome, goog:chromeOptions: {args: [remote-allow-origins=*, test-type, no-sandbox, ignore-certificate-errors, --window-size=1000,800, incognito, disable-infobars, disable-gpu, disable-default-apps, disable-popup-blocking, disable-dev-shm-usage, disable-extensions, disable-web-security, disable-translate, disable-logging, remote-allow-origins=*, --headless=chrome, --headless], extensions: []}}
Feb 06, 2026 4:29:34 AM 
org.openqa.selenium.devtools.CdpVersionFinder 
findNearestMatch
WARNING: Unable to find an exact match for CDP version 
144, returning the closest version; found: 143; Please 
update to a Selenium version that supports CDP version 
144
Feb 06, 2026 4:29:34 AM 
org.openqa.selenium.devtools.CdpVersionFinder 
findNearestMatch
WARNING: Unable to find an exact match for CDP version 
144, returning the closest version; found: 143; Please 
update to a Selenium version that supports CDP version 
144
  ✔ Given the user has a valid session                                       # steps.api.sales.SalesSteps.theUserHasAValidSession()
  ✔ Given the admin has a valid session                                             # steps.api.sales.SalesSteps.theAdminHasAValidSession()
DEBUG: Creating category 'ParentCat' as Admin
  ✔ When I create a category with name "abcdee"                                     # steps.api.category.CategorySteps.iCreateACategoryWithName(java.lang.String)
  ✘ Then the response status code should be 201                                     # steps.api.CommonApiSteps.theResponseStatusCodeShouldBe(int)
        java.lang.AssertionError: 1 expectation failed.
        Expected status code <201> but was <400>.
        
        	at java.base/jdk.internal.reflect.DirectConstructorHandleAccessor.newInstance(DirectConstructorHandleAccessor.java:62)
        	at java.base/java.lang.reflect.Constructor.newInstanceWithCaller(Constructor.java:502)
        	at java.base/java.lang.reflect.Constructor.newInstance(Constructor.java:486)
        	at org.codehaus.groovy.reflection.CachedConstructor.invoke(CachedConstructor.java:73)
        	at org.codehaus.groovy.reflection.CachedConstructor.doConstructorInvoke(CachedConstructor.java:60)
        	at org.codehaus.groovy.runtime.callsite.ConstructorSite$ConstructorSiteNoUnwrap.callConstructor(ConstructorSite.java:86)
        	at org.codehaus.groovy.runtime.callsite.CallSiteArray.defaultCallConstructor(CallSiteArray.java:57)
        	at org.codehaus.groovy.runtime.callsite.AbstractCallSite.callConstructor(AbstractCallSite.java:263)
        	at org.codehaus.groovy.runtime.callsite.AbstractCallSite.callConstructor(AbstractCallSite.java:277)
        	at io.restassured.internal.ResponseSpecificationImpl$HamcrestAssertionClosure.validate(ResponseSpecificationImpl.groovy:512)
        	at io.restassured.internal.ResponseSpecificationImpl$HamcrestAssertionClosure$validate$4.call(Unknown Source)
        	at org.codehaus.groovy.runtime.callsite.CallSiteArray.defaultCall(CallSiteArray.java:45)
        	at org.codehaus.groovy.runtime.callsite.AbstractCallSite.call(AbstractCallSite.java:125)
        	at org.codehaus.groovy.runtime.callsite.AbstractCallSite.call(AbstractCallSite.java:139)
        	at io.restassured.internal.ResponseSpecificationImpl.validateResponseIfRequired(ResponseSpecificationImpl.groovy:696)
        	at io.restassured.internal.ResponseSpecificationImpl.this$2$validateResponseIfRequired(ResponseSpecificationImpl.groovy)
        	at java.base/jdk.internal.reflect.DirectMethodHandleAccessor.invoke(DirectMethodHandleAccessor.java:103)
        	at java.base/java.lang.reflect.Method.invoke(Method.java:580)
        	at org.codehaus.groovy.runtime.callsite.PlainObjectMetaMethodSite.doInvoke(PlainObjectMetaMethodSite.java:43)
        	at org.codehaus.groovy.runtime.callsite.PogoMetaMethodSite$PogoCachedMethodSiteNoUnwrapNoCoerce.invoke(PogoMetaMethodSite.java:198)
        	at org.codehaus.groovy.runtime.callsite.PogoMetaMethodSite.callCurrent(PogoMetaMethodSite.java:62)
        	at org.codehaus.groovy.runtime.callsite.CallSiteArray.defaultCallCurrent(CallSiteArray.java:49)
        	at org.codehaus.groovy.runtime.callsite.AbstractCallSite.callCurrent(AbstractCallSite.java:171)
        	at org.codehaus.groovy.runtime.callsite.AbstractCallSite.callCurrent(AbstractCallSite.java:185)
        	at io.restassured.internal.ResponseSpecificationImpl.statusCode(ResponseSpecificationImpl.groovy:135)
        	at io.restassured.specification.ResponseSpecification$statusCode$1.callCurrent(Unknown Source)
        	at org.codehaus.groovy.runtime.callsite.CallSiteArray.defaultCallCurrent(CallSiteArray.java:49)
        	at org.codehaus.groovy.runtime.callsite.AbstractCallSite.callCurrent(AbstractCallSite.java:171)
        	at org.codehaus.groovy.runtime.callsite.AbstractCallSite.callCurrent(AbstractCallSite.java:185)
        	at io.restassured.internal.ResponseSpecificationImpl.statusCode(ResponseSpecificationImpl.groovy:143)
        	at io.restassured.internal.ValidatableResponseOptionsImpl.statusCode(ValidatableResponseOptionsImpl.java:89)
        	at steps.api.CommonApiSteps.theResponseStatusCodeShouldBe(CommonApiSteps.java:12)
        	at ✽.the response status code should be 201(classpath:features/api/category/category_api.feature:10)
  ↷ And the response body should return correct category details with name "abcdee" # steps.api.category.CategorySteps.theResponseBodyShouldReturnCorrectCategoryDetailsWithName(java.lang.String)
  ↷ And the new category should be present in the categories list                   # steps.api.category.CategorySteps.theNewCategoryShouldBePresentInTheCategoriesList()
  ✔ And the admin has created a category with name "ParentCat"               # steps.api.category.CategorySteps.theAdminHasCreatedACategoryWithName(java.lang.String)

@admin_auth
Scenario: CM2_API_A_02 Reject Category Creation without Name                 # classpath:features/api/category/category_api.feature:15
  ✔ When I create a sub-category with name "SubCat" under parent "ParentCat" # steps.api.category.CategorySteps.iCreateASubCategoryWithNameUnderParent(java.lang.String,java.lang.String)
  ✘ Then the response status code should be 403                              # steps.api.CommonApiSteps.theResponseStatusCodeShouldBe(int)
        java.lang.AssertionError: 1 expectation failed.
        Expected status code <403> but was <500>.
        
        	at java.base/jdk.internal.reflect.DirectConstructorHandleAccessor.newInstance(DirectConstructorHandleAccessor.java:62)
        	at java.base/java.lang.reflect.Constructor.newInstanceWithCaller(Constructor.java:502)
        	at java.base/java.lang.reflect.Constructor.newInstance(Constructor.java:486)
        	at org.codehaus.groovy.reflection.CachedConstructor.invoke(CachedConstructor.java:73)
        	at org.codehaus.groovy.reflection.CachedConstructor.doConstructorInvoke(CachedConstructor.java:60)
        	at org.codehaus.groovy.runtime.callsite.ConstructorSite$ConstructorSiteNoUnwrap.callConstructor(ConstructorSite.java:86)
        	at org.codehaus.groovy.runtime.callsite.AbstractCallSite.callConstructor(AbstractCallSite.java:277)
        	at io.restassured.internal.ResponseSpecificationImpl$HamcrestAssertionClosure.validate(ResponseSpecificationImpl.groovy:512)
        	at io.restassured.internal.ResponseSpecificationImpl$HamcrestAssertionClosure$validate$4.call(Unknown Source)
        	at io.restassured.internal.ResponseSpecificationImpl.validateResponseIfRequired(ResponseSpecificationImpl.groovy:696)
        	at io.restassured.internal.ResponseSpecificationImpl.this$2$validateResponseIfRequired(ResponseSpecificationImpl.groovy)
        	at java.base/jdk.internal.reflect.DirectMethodHandleAccessor.invoke(DirectMethodHandleAccessor.java:103)
        	at java.base/java.lang.reflect.Method.invoke(Method.java:580)
        	at org.codehaus.groovy.runtime.callsite.PlainObjectMetaMethodSite.doInvoke(PlainObjectMetaMethodSite.java:43)
        	at org.codehaus.groovy.runtime.callsite.PogoMetaMethodSite$PogoCachedMethodSiteNoUnwrapNoCoerce.invoke(PogoMetaMethodSite.java:198)
        	at org.codehaus.groovy.runtime.callsite.PogoMetaMethodSite.callCurrent(PogoMetaMethodSite.java:62)
        	at org.codehaus.groovy.runtime.callsite.AbstractCallSite.callCurrent(AbstractCallSite.java:185)
        	at io.restassured.internal.ResponseSpecificationImpl.statusCode(ResponseSpecificationImpl.groovy:135)
        	at io.restassured.specification.ResponseSpecification$statusCode$1.callCurrent(Unknown Source)
        	at io.restassured.internal.ResponseSpecificationImpl.statusCode(ResponseSpecificationImpl.groovy:143)
        	at io.restassured.internal.ValidatableResponseOptionsImpl.statusCode(ValidatableResponseOptionsImpl.java:89)
        	at steps.api.CommonApiSteps.theResponseStatusCodeShouldBe(CommonApiSteps.java:12)
        	at ✽.the response status code should be 403(classpath:features/api/category/category_api.feature:84)
  ↷ And the response should indicate insufficient permissions                # steps.api.category.CategorySteps.theResponseShouldIndicateInsufficientPermissions()

@user_auth
Scenario: CM2_API_U_04 Reject Edit Category via API (User)    # classpath:features/api/category/category_api.feature:72
  ✔ Given the admin has a valid session                                      # steps.api.sales.SalesSteps.theAdminHasAValidSession()
  ✔ When I create a category with missing name                               # steps.api.category.CategorySteps.iCreateACategoryWithMissingName()
  ✔ Then the response status code should be 400                              # steps.api.CommonApiSteps.theResponseStatusCodeShouldBe(int)
  ✔ Given the user has a valid session                        # steps.api.sales.SalesSteps.theUserHasAValidSession()
  ✔ And the response body should contain a validation error for missing name # steps.api.category.CategorySteps.theResponseBodyShouldContainAValidationErrorForMissingName()

@admin_auth
Scenario: CM2_API_A_03 Update Category via API                                      # classpath:features/api/category/category_api.feature:22
DEBUG: Creating category 'OldCat' as Admin
  ✔ Given the admin has a valid session                                             # steps.api.sales.SalesSteps.theAdminHasAValidSession()
  ✔ And the admin has created a category with name "OldCat"   # steps.api.category.CategorySteps.theAdminHasCreatedACategoryWithName(java.lang.String)
  ✔ And a category exists with name "OldCat"                                        # steps.api.category.CategorySteps.aCategoryExistsWithName(java.lang.String)
  ✔ When I update the category name to "UserEdt"              # steps.api.category.CategorySteps.iUpdateTheCategoryNameTo(java.lang.String)
  ✔ Then the response status code should be 403               # steps.api.CommonApiSteps.theResponseStatusCodeShouldBe(int)
  ✔ And the response should indicate insufficient permissions # steps.api.category.CategorySteps.theResponseShouldIndicateInsufficientPermissions()

@user_auth
Scenario: CM2_API_U_03 Reject Delete Category API Request (User) # classpath:features/api/category/category_api.feature:64
  ✔ When I update the category name to "NewCat"                                     # steps.api.category.CategorySteps.iUpdateTheCategoryNameTo(java.lang.String)
  ✘ Then the response status code should be 200                                     # steps.api.CommonApiSteps.theResponseStatusCodeShouldBe(int)
        java.lang.AssertionError: 1 expectation failed.
        Expected status code <200> but was <403>.
        
        	at java.base/jdk.internal.reflect.DirectConstructorHandleAccessor.newInstance(DirectConstructorHandleAccessor.java:62)
        	at java.base/java.lang.reflect.Constructor.newInstanceWithCaller(Constructor.java:502)
        	at java.base/java.lang.reflect.Constructor.newInstance(Constructor.java:486)
        	at org.codehaus.groovy.reflection.CachedConstructor.invoke(CachedConstructor.java:73)
        	at org.codehaus.groovy.reflection.CachedConstructor.doConstructorInvoke(CachedConstructor.java:60)
        	at org.codehaus.groovy.runtime.callsite.ConstructorSite$ConstructorSiteNoUnwrap.callConstructor(ConstructorSite.java:86)
        	at org.codehaus.groovy.runtime.callsite.AbstractCallSite.callConstructor(AbstractCallSite.java:277)
        	at io.restassured.internal.ResponseSpecificationImpl$HamcrestAssertionClosure.validate(ResponseSpecificationImpl.groovy:512)
        	at io.restassured.internal.ResponseSpecificationImpl$HamcrestAssertionClosure$validate$4.call(Unknown Source)
        	at io.restassured.internal.ResponseSpecificationImpl.validateResponseIfRequired(ResponseSpecificationImpl.groovy:696)
        	at io.restassured.internal.ResponseSpecificationImpl.this$2$validateResponseIfRequired(ResponseSpecificationImpl.groovy)
        	at java.base/jdk.internal.reflect.DirectMethodHandleAccessor.invoke(DirectMethodHandleAccessor.java:103)
        	at java.base/java.lang.reflect.Method.invoke(Method.java:580)
        	at org.codehaus.groovy.runtime.callsite.PlainObjectMetaMethodSite.doInvoke(PlainObjectMetaMethodSite.java:43)
        	at org.codehaus.groovy.runtime.callsite.PogoMetaMethodSite$PogoCachedMethodSiteNoUnwrapNoCoerce.invoke(PogoMetaMethodSite.java:198)
        	at org.codehaus.groovy.runtime.callsite.PogoMetaMethodSite.callCurrent(PogoMetaMethodSite.java:62)
        	at org.codehaus.groovy.runtime.callsite.AbstractCallSite.callCurrent(AbstractCallSite.java:185)
        	at io.restassured.internal.ResponseSpecificationImpl.statusCode(ResponseSpecificationImpl.groovy:135)
        	at io.restassured.specification.ResponseSpecification$statusCode$1.callCurrent(Unknown Source)
        	at io.restassured.internal.ResponseSpecificationImpl.statusCode(ResponseSpecificationImpl.groovy:143)
        	at io.restassured.internal.ValidatableResponseOptionsImpl.statusCode(ValidatableResponseOptionsImpl.java:89)
        	at steps.api.CommonApiSteps.theResponseStatusCodeShouldBe(CommonApiSteps.java:12)
        	at ✽.the response status code should be 200(classpath:features/api/category/category_api.feature:26)
  ↷ And the response body should return correct category details with name "NewCat" # steps.api.category.CategorySteps.theResponseBodyShouldReturnCorrectCategoryDetailsWithName(java.lang.String)

@admin_auth
Scenario: CM2_API_A_04 Delete Category via API  # classpath:features/api/category/category_api.feature:30
  ✔ Given the user has a valid session                           # steps.api.sales.SalesSteps.theUserHasAValidSession()
DEBUG: Creating category 'DelCat' as Admin
  ✔ Given the admin has a valid session         # steps.api.sales.SalesSteps.theAdminHasAValidSession()
DEBUG: Creating category 'DelCat' as Admin
  ✔ When Admin navigates to the "Sales" page                  # steps.ui.common.NavigationSteps.navigateToPage(java.lang.String)
  ✔ When Admin navigates to the "Sales" page             # steps.ui.common.NavigationSteps.navigateToPage(java.lang.String)
  ✔ And a category exists with name "DelCat"    # steps.api.category.CategorySteps.aCategoryExistsWithName(java.lang.String)
DEBUG: Admin creation failed with status 400: {"status":400,"error":"DUPLICATE_RESOURCE","message":"Main category 'DelCat' already exists","timestamp":"2026-02-06T04:29:39.9645293"}
  ✔ And the admin has created a category with name "DelCat"      # steps.api.category.CategorySteps.theAdminHasCreatedACategoryWithName(java.lang.String)
  ✔ When I delete the category                                   # steps.api.category.CategorySteps.iDeleteTheCategory()
  ✔ When I delete the category                  # steps.api.category.CategorySteps.iDeleteTheCategory()
  ✘ Then the response status code should be 403                  # steps.api.CommonApiSteps.theResponseStatusCodeShouldBe(int)
        java.lang.AssertionError: 1 expectation failed.
        Expected status code <403> but was <204>.
        
        	at java.base/jdk.internal.reflect.DirectConstructorHandleAccessor.newInstance(DirectConstructorHandleAccessor.java:62)
        	at java.base/java.lang.reflect.Constructor.newInstanceWithCaller(Constructor.java:502)
        	at java.base/java.lang.reflect.Constructor.newInstance(Constructor.java:486)
        	at org.codehaus.groovy.reflection.CachedConstructor.invoke(CachedConstructor.java:73)
        	at org.codehaus.groovy.reflection.CachedConstructor.doConstructorInvoke(CachedConstructor.java:60)
        	at org.codehaus.groovy.runtime.callsite.ConstructorSite$ConstructorSiteNoUnwrap.callConstructor(ConstructorSite.java:86)
        	at org.codehaus.groovy.runtime.callsite.AbstractCallSite.callConstructor(AbstractCallSite.java:277)
        	at io.restassured.internal.ResponseSpecificationImpl$HamcrestAssertionClosure.validate(ResponseSpecificationImpl.groovy:512)
        	at io.restassured.internal.ResponseSpecificationImpl$HamcrestAssertionClosure$validate$4.call(Unknown Source)
        	at io.restassured.internal.ResponseSpecificationImpl.validateResponseIfRequired(ResponseSpecificationImpl.groovy:696)
        	at io.restassured.internal.ResponseSpecificationImpl.this$2$validateResponseIfRequired(ResponseSpecificationImpl.groovy)
        	at java.base/jdk.internal.reflect.DirectMethodHandleAccessor.invoke(DirectMethodHandleAccessor.java:103)
        	at java.base/java.lang.reflect.Method.invoke(Method.java:580)
        	at org.codehaus.groovy.runtime.callsite.PlainObjectMetaMethodSite.doInvoke(PlainObjectMetaMethodSite.java:43)
        	at org.codehaus.groovy.runtime.callsite.PogoMetaMethodSite$PogoCachedMethodSiteNoUnwrapNoCoerce.invoke(PogoMetaMethodSite.java:198)
        	at org.codehaus.groovy.runtime.callsite.PogoMetaMethodSite.callCurrent(PogoMetaMethodSite.java:62)
        	at org.codehaus.groovy.runtime.callsite.AbstractCallSite.callCurrent(AbstractCallSite.java:185)
        	at io.restassured.internal.ResponseSpecificationImpl.statusCode(ResponseSpecificationImpl.groovy:135)
        	at io.restassured.specification.ResponseSpecification$statusCode$1.callCurrent(Unknown Source)
        	at io.restassured.internal.ResponseSpecificationImpl.statusCode(ResponseSpecificationImpl.groovy:143)
        	at io.restassured.internal.ValidatableResponseOptionsImpl.statusCode(ValidatableResponseOptionsImpl.java:89)
        	at steps.api.CommonApiSteps.theResponseStatusCodeShouldBe(CommonApiSteps.java:12)
        	at ✽.the response status code should be 403(classpath:features/api/category/category_api.feature:68)
  ↷ And the response should indicate insufficient permissions    # steps.api.category.CategorySteps.theResponseShouldIndicateInsufficientPermissions()
  ✔ Then the response status code should be 204 # steps.api.CommonApiSteps.theResponseStatusCodeShouldBe(int)

@user_auth
Scenario: CM2_API_U_02 Enforce Category Management Access Control (User) # classpath:features/api/category/category_api.feature:54
  ✔ And the category should no longer exist     # steps.api.category.CategorySteps.theCategoryShouldNoLongerExist()

@admin_auth
Scenario: CM2_API_A_05 Reject Duplicate Category Creation via API   # classpath:features/api/category/category_api.feature:38
  ✔ Then Admin should see the sales table                     # steps.ui.sales.SalesSteps.verifySalesTable()
  ✔ Given the user has a valid session                                   # steps.api.sales.SalesSteps.theUserHasAValidSession()
  ✔ When I create a category with name "UserCat"                         # steps.api.category.CategorySteps.iCreateACategoryWithName(java.lang.String)
  ✔ Then the response status code should be 403                          # steps.api.CommonApiSteps.theResponseStatusCodeShouldBe(int)
  ✔ When I update the category name to "UserUpd"                         # steps.api.category.CategorySteps.iUpdateTheCategoryNameTo(java.lang.String)
  ✔ Then the response status code should be 403                          # steps.api.CommonApiSteps.theResponseStatusCodeShouldBe(int)
  ✘ When I delete the category                                           # steps.api.category.CategorySteps.iDeleteTheCategory()
        java.lang.RuntimeException: Category 'DelCat' not found
        	at steps.api.category.CategorySteps.lambda$iDeleteTheCategory$3(CategorySteps.java:120)
        	at java.base/java.util.Optional.orElseThrow(Optional.java:403)
        	at steps.api.category.CategorySteps.iDeleteTheCategory(CategorySteps.java:120)
        	at ✽.I delete the category(classpath:features/api/category/category_api.feature:60)
  ↷ Then the response status code should be 403                          # steps.api.CommonApiSteps.theResponseStatusCodeShouldBe(int)

@user_auth
Scenario: CM2_API_U_01 Reject Add Category API Request (User) # classpath:features/api/category/category_api.feature:47
  ✔ Given the admin has a valid session                             # steps.api.sales.SalesSteps.theAdminHasAValidSession()
  ✔ And a category exists with name "DupCat"                        # steps.api.category.CategorySteps.aCategoryExistsWithName(java.lang.String)
  ✔ When I create a category with name "DupCat"                     # steps.api.category.CategorySteps.iCreateACategoryWithName(java.lang.String)
  ✔ Then the response status code should be 400                     # steps.api.CommonApiSteps.theResponseStatusCodeShouldBe(int)
  ✔ And the response body should contain a duplicate resource error # steps.api.category.CategorySteps.theResponseBodyShouldContainADuplicateResourceError()
  ✔ And no new duplicate category should be created                 # steps.api.category.CategorySteps.noNewDuplicateCategoryShouldBeCreated()
  ✔ Given the user has a valid session                        # steps.api.sales.SalesSteps.theUserHasAValidSession()
  ✔ When I create a category with name "UserCat"              # steps.api.category.CategorySteps.iCreateACategoryWithName(java.lang.String)
  ✔ Then the response status code should be 403               # steps.api.CommonApiSteps.theResponseStatusCodeShouldBe(int)
  ✔ And the response should indicate insufficient permissions # steps.api.category.CategorySteps.theResponseShouldIndicateInsufficientPermissions()
  ✔ And the sales table should contain the following columns: # steps.ui.sales.SalesSteps.verifyTableColumns(io.cucumber.datatable.DataTable)
      | Plant       |
      | Quantity    |
      | Total Price |
      | Sold At     |
  ✔ And Admin clicks the "Sell Plant" button             # steps.ui.sales.SalesSteps.clickSellPlantButton()
  ✔ Then the "Sell Plant" form should open successfully  # steps.ui.sales.SalesSteps.verifySellPlantFormOpens()
04:29:41.345 [ForkJoinPool-2-worker-1] INFO  n.t.m.logging.ConsoleLoggingListener - 
  _____   ___   ___   _____     ___   _____     _     ___   _____   ___   ___  
 |_   _| | __| / __| |_   _|   / __| |_   _|   /_\   | _ \ |_   _| | __| |   \ 
   | |   | _|  \__ \   | |     \__ \   | |    / _ \  |   /   | |   | _|  | |) |
   |_|   |___| |___/   |_|     |___/   |_|   /_/ \_\ |_|_\   |_|   |___| |___/ 

SM_UI_A_01 View Sales List(sales-management;sm-ui-a-01-view-sales-list)
--------------------------------------------------------------------------------
04:29:41.362 [ForkJoinPool-2-worker-1] INFO  n.t.m.logging.ConsoleLoggingListener - 
  _____   ___   ___   _____     ___     _     ___   ___   ___   ___  
 |_   _| | __| / __| |_   _|   | _ \   /_\   / __| / __| | __| |   \ 
   | |   | _|  \__ \   | |     |  _/  / _ \  \__ \ \__ \ | _|  | |) |
   |_|   |___| |___/   |_|     |_|   /_/ \_\ |___/ |___/ |___| |___/ 

SM_UI_A_01 View Sales List
----------------------------------------------------------------------
04:29:41.378 [ForkJoinPool-2-worker-1] INFO  n.t.m.logging.ConsoleLoggingListener - 
  _____   ___   ___   _____     ___   _____     _     ___   _____   ___   ___  
 |_   _| | __| / __| |_   _|   / __| |_   _|   /_\   | _ \ |_   _| | __| |   \ 
   | |   | _|  \__ \   | |     \__ \   | |    / _ \  |   /   | |   | _|  | |) |
   |_|   |___| |___/   |_|     |___/   |_|   /_/ \_\ |_|_\   |_|   |___| |___/ 

SM_UI_A_03 Verify Sell Plant Button Visibility(sales-management;sm-ui-a-03-verify-sell-plant-button-visibility)
--------------------------------------------------------------------------------
04:29:41.390 [ForkJoinPool-2-worker-1] INFO  n.t.m.logging.ConsoleLoggingListener - 
  _____   ___   ___   _____     ___     _     ___   ___   ___   ___  
 |_   _| | __| / __| |_   _|   | _ \   /_\   / __| / __| | __| |   \ 
   | |   | _|  \__ \   | |     |  _/  / _ \  \__ \ \__ \ | _|  | |) |
   |_|   |___| |___/   |_|     |_|   /_/ \_\ |___/ |___/ |___| |___/ 

SM_UI_A_03 Verify Sell Plant Button Visibility
----------------------------------------------------------------------
04:29:41.405 [ForkJoinPool-2-worker-1] INFO  n.t.m.logging.ConsoleLoggingListener - 
  _____   ___   ___   _____     ___   _____     _     ___   _____   ___   ___  
 |_   _| | __| / __| |_   _|   / __| |_   _|   /_\   | _ \ |_   _| | __| |   \ 
   | |   | _|  \__ \   | |     \__ \   | |    / _ \  |   /   | |   | _|  | |) |
   |_|   |___| |___/   |_|     |___/   |_|   /_/ \_\ |_|_\   |_|   |___| |___/ 

CM2_API_A_01 Create Category via API Successfully(category-management-api;cm2-api-a-01-create-category-via-api-successfully)
--------------------------------------------------------------------------------
04:29:41.428 [ForkJoinPool-2-worker-1] INFO  n.t.m.logging.ConsoleLoggingListener - 
  _____   ___   ___   _____     ___   _____     _     ___   _____   ___   ___  
 |_   _| | __| / __| |_   _|   / __| |_   _|   /_\   | _ \ |_   _| | __| |   \ 
   | |   | _|  \__ \   | |     \__ \   | |    / _ \  |   /   | |   | _|  | |) |
   |_|   |___| |___/   |_|     |___/   |_|   /_/ \_\ |_|_\   |_|   |___| |___/ 

CM2_API_A_02 Reject Category Creation without Name(category-management-api;cm2-api-a-02-reject-category-creation-without-name)
--------------------------------------------------------------------------------
04:29:41.436 [ForkJoinPool-2-worker-1] INFO  n.t.m.logging.ConsoleLoggingListener - 
  _____   ___   ___   _____     ___     _     ___   ___   ___   ___  
 |_   _| | __| / __| |_   _|   | _ \   /_\   / __| / __| | __| |   \ 
   | |   | _|  \__ \   | |     |  _/  / _ \  \__ \ \__ \ | _|  | |) |
   |_|   |___| |___/   |_|     |_|   /_/ \_\ |___/ |___/ |___| |___/ 

CM2_API_A_02 Reject Category Creation without Name
----------------------------------------------------------------------
04:29:41.452 [ForkJoinPool-2-worker-1] INFO  n.t.m.logging.ConsoleLoggingListener - 
  _____   ___   ___   _____     ___   _____     _     ___   _____   ___   ___  
 |_   _| | __| / __| |_   _|   / __| |_   _|   /_\   | _ \ |_   _| | __| |   \ 
   | |   | _|  \__ \   | |     \__ \   | |    / _ \  |   /   | |   | _|  | |) |
   |_|   |___| |___/   |_|     |___/   |_|   /_/ \_\ |_|_\   |_|   |___| |___/ 

CM2_API_A_03 Update Category via API(category-management-api;cm2-api-a-03-update-category-via-api)
--------------------------------------------------------------------------------
04:29:41.461 [ForkJoinPool-2-worker-1] INFO  n.t.m.logging.ConsoleLoggingListener - 
  _____   ___   ___   _____     ___   _____     _     ___   _____   ___   ___  
 |_   _| | __| / __| |_   _|   / __| |_   _|   /_\   | _ \ |_   _| | __| |   \ 
   | |   | _|  \__ \   | |     \__ \   | |    / _ \  |   /   | |   | _|  | |) |
   |_|   |___| |___/   |_|     |___/   |_|   /_/ \_\ |_|_\   |_|   |___| |___/ 

CM2_API_A_04 Delete Category via API(category-management-api;cm2-api-a-04-delete-category-via-api)
--------------------------------------------------------------------------------
04:29:41.471 [ForkJoinPool-2-worker-1] INFO  n.t.m.logging.ConsoleLoggingListener - 
  _____   ___   ___   _____     ___     _     ___   ___   ___   ___  
 |_   _| | __| / __| |_   _|   | _ \   /_\   / __| / __| | __| |   \ 
   | |   | _|  \__ \   | |     |  _/  / _ \  \__ \ \__ \ | _|  | |) |
   |_|   |___| |___/   |_|     |_|   /_/ \_\ |___/ |___/ |___| |___/ 

CM2_API_A_04 Delete Category via API
----------------------------------------------------------------------
04:29:41.486 [ForkJoinPool-2-worker-1] INFO  n.t.m.logging.ConsoleLoggingListener - 
  _____   ___   ___   _____     ___   _____     _     ___   _____   ___   ___  
 |_   _| | __| / __| |_   _|   / __| |_   _|   /_\   | _ \ |_   _| | __| |   \ 
   | |   | _|  \__ \   | |     \__ \   | |    / _ \  |   /   | |   | _|  | |) |
   |_|   |___| |___/   |_|     |___/   |_|   /_/ \_\ |_|_\   |_|   |___| |___/ 

CM2_API_A_05 Reject Duplicate Category Creation via API(category-management-api;cm2-api-a-05-reject-duplicate-category-creation-via-api)
--------------------------------------------------------------------------------
04:29:41.495 [ForkJoinPool-2-worker-1] INFO  n.t.m.logging.ConsoleLoggingListener - 
  _____   ___   ___   _____     ___     _     ___   ___   ___   ___  
 |_   _| | __| / __| |_   _|   | _ \   /_\   / __| / __| | __| |   \ 
   | |   | _|  \__ \   | |     |  _/  / _ \  \__ \ \__ \ | _|  | |) |
   |_|   |___| |___/   |_|     |_|   /_/ \_\ |___/ |___/ |___| |___/ 

CM2_API_A_05 Reject Duplicate Category Creation via API
----------------------------------------------------------------------
04:29:41.509 [ForkJoinPool-2-worker-1] INFO  n.t.m.logging.ConsoleLoggingListener - 
  _____   ___   ___   _____     ___   _____     _     ___   _____   ___   ___  
 |_   _| | __| / __| |_   _|   / __| |_   _|   /_\   | _ \ |_   _| | __| |   \ 
   | |   | _|  \__ \   | |     \__ \   | |    / _ \  |   /   | |   | _|  | |) |
   |_|   |___| |___/   |_|     |___/   |_|   /_/ \_\ |_|_\   |_|   |___| |___/ 

CM2_API_U_01 Reject Add Category API Request (User)(category-management-api;cm2-api-u-01-reject-add-category-api-request-(user))
--------------------------------------------------------------------------------
04:29:41.515 [ForkJoinPool-2-worker-1] INFO  n.t.m.logging.ConsoleLoggingListener - 
  _____   ___   ___   _____     ___     _     ___   ___   ___   ___  
 |_   _| | __| / __| |_   _|   | _ \   /_\   / __| / __| | __| |   \ 
   | |   | _|  \__ \   | |     |  _/  / _ \  \__ \ \__ \ | _|  | |) |
   |_|   |___| |___/   |_|     |_|   /_/ \_\ |___/ |___/ |___| |___/ 

CM2_API_U_01 Reject Add Category API Request 
----------------------------------------------------------------------
04:29:41.530 [ForkJoinPool-2-worker-1] INFO  n.t.m.logging.ConsoleLoggingListener - 
  _____   ___   ___   _____     ___   _____     _     ___   _____   ___   ___  
 |_   _| | __| / __| |_   _|   / __| |_   _|   /_\   | _ \ |_   _| | __| |   \ 
   | |   | _|  \__ \   | |     \__ \   | |    / _ \  |   /   | |   | _|  | |) |
   |_|   |___| |___/   |_|     |___/   |_|   /_/ \_\ |_|_\   |_|   |___| |___/ 

CM2_API_U_02 Enforce Category Management Access Control (User)(category-management-api;cm2-api-u-02-enforce-category-management-access-control-(user))
--------------------------------------------------------------------------------
04:29:41.547 [ForkJoinPool-2-worker-1] INFO  n.t.m.logging.ConsoleLoggingListener - 
  _____   ___   ___   _____     ___   _____     _     ___   _____   ___   ___  
 |_   _| | __| / __| |_   _|   / __| |_   _|   /_\   | _ \ |_   _| | __| |   \ 
   | |   | _|  \__ \   | |     \__ \   | |    / _ \  |   /   | |   | _|  | |) |
   |_|   |___| |___/   |_|     |___/   |_|   /_/ \_\ |_|_\   |_|   |___| |___/ 

CM2_API_U_03 Reject Delete Category API Request (User)(category-management-api;cm2-api-u-03-reject-delete-category-api-request-(user))
--------------------------------------------------------------------------------
04:29:41.561 [ForkJoinPool-2-worker-1] INFO  n.t.m.logging.ConsoleLoggingListener - 
  _____   ___   ___   _____     ___   _____     _     ___   _____   ___   ___  
 |_   _| | __| / __| |_   _|   / __| |_   _|   /_\   | _ \ |_   _| | __| |   \ 
   | |   | _|  \__ \   | |     \__ \   | |    / _ \  |   /   | |   | _|  | |) |
   |_|   |___| |___/   |_|     |___/   |_|   /_/ \_\ |_|_\   |_|   |___| |___/ 

CM2_API_U_04 Reject Edit Category via API (User)(category-management-api;cm2-api-u-04-reject-edit-category-via-api-(user))
--------------------------------------------------------------------------------
04:29:41.567 [ForkJoinPool-2-worker-1] INFO  n.t.m.logging.ConsoleLoggingListener - 
  _____   ___   ___   _____     ___     _     ___   ___   ___   ___  
 |_   _| | __| / __| |_   _|   | _ \   /_\   / __| / __| | __| |   \ 
   | |   | _|  \__ \   | |     |  _/  / _ \  \__ \ \__ \ | _|  | |) |
   |_|   |___| |___/   |_|     |_|   /_/ \_\ |___/ |___/ |___| |___/ 

CM2_API_U_04 Reject Edit Category via API 
----------------------------------------------------------------------
04:29:41.575 [ForkJoinPool-2-worker-1] INFO  n.t.m.logging.ConsoleLoggingListener - 
  _____   ___   ___   _____     ___   _____     _     ___   _____   ___   ___  
 |_   _| | __| / __| |_   _|   / __| |_   _|   /_\   | _ \ |_   _| | __| |   \ 
   | |   | _|  \__ \   | |     \__ \   | |    / _ \  |   /   | |   | _|  | |) |
   |_|   |___| |___/   |_|     |___/   |_|   /_/ \_\ |_|_\   |_|   |___| |___/ 

CM2_API_U_05 Reject Add Sub-Category via API (User)(category-management-api;cm2-api-u-05-reject-add-sub-category-via-api-(user))
--------------------------------------------------------------------------------
Feb 06, 2026 4:29:42 AM 
org.junit.platform.launcher.core.DiscoveryIssueNotifier 
logIssues
WARNING: TestEngine with ID 'cucumber' encountered a 
non-critical issue during test discovery:

(1) [WARNING] The classpath resource selector 
'features' should not be used to select features in a 
package. Use the package selector with 'features' 
instead
[ERROR] Tests run: 12, Failures: 4, Errors: 1, Skipped: 0, Time elapsed: 12.32 s <<< FAILURE! -- in starter.CucumberTestSuite
[ERROR] Category Management API.CM2_API_A_01 Create Category via API Successfully -- Time elapsed: 7.406 s <<< FAILURE!
java.lang.AssertionError: 
1 expectation failed.
Expected status code <201> but was <400>.

	at java.base/java.lang.reflect.Constructor.newInstanceWithCaller(Constructor.java:502)
	at java.base/java.lang.reflect.Constructor.newInstance(Constructor.java:486)
	at org.codehaus.groovy.reflection.CachedConstructor.invoke(CachedConstructor.java:73)
	at org.codehaus.groovy.reflection.CachedConstructor.doConstructorInvoke(CachedConstructor.java:60)
	at org.codehaus.groovy.runtime.callsite.ConstructorSite$ConstructorSiteNoUnwrap.callConstructor(ConstructorSite.java:86)
	at org.codehaus.groovy.runtime.callsite.CallSiteArray.defaultCallConstructor(CallSiteArray.java:57)
	at org.codehaus.groovy.runtime.callsite.AbstractCallSite.callConstructor(AbstractCallSite.java:263)
	at org.codehaus.groovy.runtime.callsite.AbstractCallSite.callConstructor(AbstractCallSite.java:277)
	at io.restassured.internal.ResponseSpecificationImpl$HamcrestAssertionClosure.validate(ResponseSpecificationImpl.groovy:512)
	at io.restassured.internal.ResponseSpecificationImpl$HamcrestAssertionClosure$validate$4.call(Unknown Source)
	at org.codehaus.groovy.runtime.callsite.CallSiteArray.defaultCall(CallSiteArray.java:45)
	at org.codehaus.groovy.runtime.callsite.AbstractCallSite.call(AbstractCallSite.java:125)
	at org.codehaus.groovy.runtime.callsite.AbstractCallSite.call(AbstractCallSite.java:139)
	at io.restassured.internal.ResponseSpecificationImpl.validateResponseIfRequired(ResponseSpecificationImpl.groovy:696)
	at io.restassured.internal.ResponseSpecificationImpl.this$2$validateResponseIfRequired(ResponseSpecificationImpl.groovy)
	at java.base/java.lang.reflect.Method.invoke(Method.java:580)
	at org.codehaus.groovy.runtime.callsite.PlainObjectMetaMethodSite.doInvoke(PlainObjectMetaMethodSite.java:43)
	at org.codehaus.groovy.runtime.callsite.PogoMetaMethodSite$PogoCachedMethodSiteNoUnwrapNoCoerce.invoke(PogoMetaMethodSite.java:198)
	at org.codehaus.groovy.runtime.callsite.PogoMetaMethodSite.callCurrent(PogoMetaMethodSite.java:62)
	at org.codehaus.groovy.runtime.callsite.CallSiteArray.defaultCallCurrent(CallSiteArray.java:49)
	at org.codehaus.groovy.runtime.callsite.AbstractCallSite.callCurrent(AbstractCallSite.java:171)
	at org.codehaus.groovy.runtime.callsite.AbstractCallSite.callCurrent(AbstractCallSite.java:185)
	at io.restassured.internal.ResponseSpecificationImpl.statusCode(ResponseSpecificationImpl.groovy:135)
	at io.restassured.specification.ResponseSpecification$statusCode$1.callCurrent(Unknown Source)
	at org.codehaus.groovy.runtime.callsite.CallSiteArray.defaultCallCurrent(CallSiteArray.java:49)
	at org.codehaus.groovy.runtime.callsite.AbstractCallSite.callCurrent(AbstractCallSite.java:171)
	at org.codehaus.groovy.runtime.callsite.AbstractCallSite.callCurrent(AbstractCallSite.java:185)
	at io.restassured.internal.ResponseSpecificationImpl.statusCode(ResponseSpecificationImpl.groovy:143)
	at io.restassured.internal.ValidatableResponseOptionsImpl.statusCode(ValidatableResponseOptionsImpl.java:89)
	at steps.api.CommonApiSteps.theResponseStatusCodeShouldBe(CommonApiSteps.java:12)
	at ✽.the response status code should be 201(classpath:features/api/category/category_api.feature:10)

[ERROR] Category Management API.CM2_API_U_05 Reject Add Sub-Category via API (User) -- Time elapsed: 7.569 s <<< FAILURE!
java.lang.AssertionError: 
1 expectation failed.
Expected status code <403> but was <500>.

	at java.base/java.lang.reflect.Constructor.newInstanceWithCaller(Constructor.java:502)
	at java.base/java.lang.reflect.Constructor.newInstance(Constructor.java:486)
	at org.codehaus.groovy.reflection.CachedConstructor.invoke(CachedConstructor.java:73)
	at org.codehaus.groovy.reflection.CachedConstructor.doConstructorInvoke(CachedConstructor.java:60)
	at org.codehaus.groovy.runtime.callsite.ConstructorSite$ConstructorSiteNoUnwrap.callConstructor(ConstructorSite.java:86)
	at org.codehaus.groovy.runtime.callsite.AbstractCallSite.callConstructor(AbstractCallSite.java:277)
	at io.restassured.internal.ResponseSpecificationImpl$HamcrestAssertionClosure.validate(ResponseSpecificationImpl.groovy:512)
	at io.restassured.internal.ResponseSpecificationImpl$HamcrestAssertionClosure$validate$4.call(Unknown Source)
	at io.restassured.internal.ResponseSpecificationImpl.validateResponseIfRequired(ResponseSpecificationImpl.groovy:696)
	at io.restassured.internal.ResponseSpecificationImpl.this$2$validateResponseIfRequired(ResponseSpecificationImpl.groovy)
	at java.base/java.lang.reflect.Method.invoke(Method.java:580)
	at org.codehaus.groovy.runtime.callsite.PlainObjectMetaMethodSite.doInvoke(PlainObjectMetaMethodSite.java:43)
	at org.codehaus.groovy.runtime.callsite.PogoMetaMethodSite$PogoCachedMethodSiteNoUnwrapNoCoerce.invoke(PogoMetaMethodSite.java:198)
	at org.codehaus.groovy.runtime.callsite.PogoMetaMethodSite.callCurrent(PogoMetaMethodSite.java:62)
	at org.codehaus.groovy.runtime.callsite.AbstractCallSite.callCurrent(AbstractCallSite.java:185)
	at io.restassured.internal.ResponseSpecificationImpl.statusCode(ResponseSpecificationImpl.groovy:135)
	at io.restassured.specification.ResponseSpecification$statusCode$1.callCurrent(Unknown Source)
	at io.restassured.internal.ResponseSpecificationImpl.statusCode(ResponseSpecificationImpl.groovy:143)
	at io.restassured.internal.ValidatableResponseOptionsImpl.statusCode(ValidatableResponseOptionsImpl.java:89)
	at steps.api.CommonApiSteps.theResponseStatusCodeShouldBe(CommonApiSteps.java:12)
	at ✽.the response status code should be 403(classpath:features/api/category/category_api.feature:84)

[ERROR] Category Management API.CM2_API_A_03 Update Category via API -- Time elapsed: 0.575 s <<< FAILURE!
java.lang.AssertionError: 
1 expectation failed.
Expected status code <200> but was <403>.

	at java.base/java.lang.reflect.Constructor.newInstanceWithCaller(Constructor.java:502)
	at java.base/java.lang.reflect.Constructor.newInstance(Constructor.java:486)
	at org.codehaus.groovy.reflection.CachedConstructor.invoke(CachedConstructor.java:73)
	at org.codehaus.groovy.reflection.CachedConstructor.doConstructorInvoke(CachedConstructor.java:60)
	at org.codehaus.groovy.runtime.callsite.ConstructorSite$ConstructorSiteNoUnwrap.callConstructor(ConstructorSite.java:86)
	at org.codehaus.groovy.runtime.callsite.AbstractCallSite.callConstructor(AbstractCallSite.java:277)
	at io.restassured.internal.ResponseSpecificationImpl$HamcrestAssertionClosure.validate(ResponseSpecificationImpl.groovy:512)
	at io.restassured.internal.ResponseSpecificationImpl$HamcrestAssertionClosure$validate$4.call(Unknown Source)
	at io.restassured.internal.ResponseSpecificationImpl.validateResponseIfRequired(ResponseSpecificationImpl.groovy:696)
	at io.restassured.internal.ResponseSpecificationImpl.this$2$validateResponseIfRequired(ResponseSpecificationImpl.groovy)
	at java.base/java.lang.reflect.Method.invoke(Method.java:580)
	at org.codehaus.groovy.runtime.callsite.PlainObjectMetaMethodSite.doInvoke(PlainObjectMetaMethodSite.java:43)
	at org.codehaus.groovy.runtime.callsite.PogoMetaMethodSite$PogoCachedMethodSiteNoUnwrapNoCoerce.invoke(PogoMetaMethodSite.java:198)
	at org.codehaus.groovy.runtime.callsite.PogoMetaMethodSite.callCurrent(PogoMetaMethodSite.java:62)
	at org.codehaus.groovy.runtime.callsite.AbstractCallSite.callCurrent(AbstractCallSite.java:185)
	at io.restassured.internal.ResponseSpecificationImpl.statusCode(ResponseSpecificationImpl.groovy:135)
	at io.restassured.specification.ResponseSpecification$statusCode$1.callCurrent(Unknown Source)
	at io.restassured.internal.ResponseSpecificationImpl.statusCode(ResponseSpecificationImpl.groovy:143)
	at io.restassured.internal.ValidatableResponseOptionsImpl.statusCode(ValidatableResponseOptionsImpl.java:89)
	at steps.api.CommonApiSteps.theResponseStatusCodeShouldBe(CommonApiSteps.java:12)
	at ✽.the response status code should be 200(classpath:features/api/category/category_api.feature:26)

[ERROR] Category Management API.CM2_API_U_03 Reject Delete Category API Request (User) -- Time elapsed: 0.856 s <<< FAILURE!
java.lang.AssertionError: 
1 expectation failed.
Expected status code <403> but was <204>.

	at java.base/java.lang.reflect.Constructor.newInstanceWithCaller(Constructor.java:502)
	at java.base/java.lang.reflect.Constructor.newInstance(Constructor.java:486)
	at org.codehaus.groovy.reflection.CachedConstructor.invoke(CachedConstructor.java:73)
	at org.codehaus.groovy.reflection.CachedConstructor.doConstructorInvoke(CachedConstructor.java:60)
	at org.codehaus.groovy.runtime.callsite.ConstructorSite$ConstructorSiteNoUnwrap.callConstructor(ConstructorSite.java:86)
	at org.codehaus.groovy.runtime.callsite.AbstractCallSite.callConstructor(AbstractCallSite.java:277)
	at io.restassured.internal.ResponseSpecificationImpl$HamcrestAssertionClosure.validate(ResponseSpecificationImpl.groovy:512)
	at io.restassured.internal.ResponseSpecificationImpl$HamcrestAssertionClosure$validate$4.call(Unknown Source)
	at io.restassured.internal.ResponseSpecificationImpl.validateResponseIfRequired(ResponseSpecificationImpl.groovy:696)
	at io.restassured.internal.ResponseSpecificationImpl.this$2$validateResponseIfRequired(ResponseSpecificationImpl.groovy)
	at java.base/java.lang.reflect.Method.invoke(Method.java:580)
	at org.codehaus.groovy.runtime.callsite.PlainObjectMetaMethodSite.doInvoke(PlainObjectMetaMethodSite.java:43)
	at org.codehaus.groovy.runtime.callsite.PogoMetaMethodSite$PogoCachedMethodSiteNoUnwrapNoCoerce.invoke(PogoMetaMethodSite.java:198)
	at org.codehaus.groovy.runtime.callsite.PogoMetaMethodSite.callCurrent(PogoMetaMethodSite.java:62)
	at org.codehaus.groovy.runtime.callsite.AbstractCallSite.callCurrent(AbstractCallSite.java:185)
	at io.restassured.internal.ResponseSpecificationImpl.statusCode(ResponseSpecificationImpl.groovy:135)
	at io.restassured.specification.ResponseSpecification$statusCode$1.callCurrent(Unknown Source)
	at io.restassured.internal.ResponseSpecificationImpl.statusCode(ResponseSpecificationImpl.groovy:143)
	at io.restassured.internal.ValidatableResponseOptionsImpl.statusCode(ValidatableResponseOptionsImpl.java:89)
	at steps.api.CommonApiSteps.theResponseStatusCodeShouldBe(CommonApiSteps.java:12)
	at ✽.the response status code should be 403(classpath:features/api/category/category_api.feature:68)

[ERROR] Category Management API.CM2_API_U_02 Enforce Category Management Access Control (User) -- Time elapsed: 0.641 s <<< ERROR!
java.lang.RuntimeException: Category 'DelCat' not found
	at steps.api.category.CategorySteps.lambda$iDeleteTheCategory$3(CategorySteps.java:120)
	at java.base/java.util.Optional.orElseThrow(Optional.java:403)
	at steps.api.category.CategorySteps.iDeleteTheCategory(CategorySteps.java:120)
	at ✽.I delete the category(classpath:features/api/category/category_api.feature:60)

Feb 06, 2026 4:29:42 AM 
org.junit.platform.launcher.core.DiscoveryIssueNotifier 
logIssues
WARNING: TestEngine with ID 'junit-platform-suite' 
encountered a non-critical issue during test discovery:

(1) [WARNING] [cucumber] The classpath resource 
selector 'features' should not be used to select 
features in a package. Use the package selector with 
'features' instead (via @Suite 
starter.CucumberTestSuite).
[INFO] 
[INFO] Results:
[INFO] 
[ERROR] Failures: 
[ERROR]   1 expectation failed.
Expected status code <201> but was <400>.

[ERROR]   1 expectation failed.
Expected status code <200> but was <403>.

[ERROR]   1 expectation failed.
Expected status code <403> but was <204>.

[ERROR]   1 expectation failed.
Expected status code <403> but was <500>.

[ERROR] Errors: 
[ERROR]   Category 'DelCat' not found
[INFO] 
[ERROR] Tests run: 12, Failures: 4, Errors: 1, Skipped: 0
[INFO] 
[INFO] 
[INFO] --- serenity:5.0.4:aggregate (serenity-reports) @ cucumber-starter ---
[INFO] GENERATING REPORTS FOR: D:\L4S1\ITQA\ITFac_Batch21_Group58
[INFO] GENERATING REPORTS USING 16 THREADS
[INFO] 
[INFO] ------------------------------------------------------------------------
[INFO] Serenity BDD Test Results
[INFO]   - Report guide: https://serenity-bdd.github.io
[INFO]   - Results: 0 tests | 0 passed | 0 failed | 0 errors | 0 compromised | 0 pending | 0 aborted
[INFO] ------------------------------------------------------------------------
[INFO] 
[INFO] Generating Serenity BDD Reports
[INFO]   ✓ Summary reports
[INFO]   ✓ Requirements reports
[INFO]   ✓ Result reports
[INFO]   ✓ Error reports
[INFO] 
[INFO] Reports generated in 4 secs
[INFO] 
[INFO] 📊 Interactive Report: file:///D:/L4S1/ITQA/ITFac_Batch21_Group58/target/site/serenity/index.html
[INFO] 📄 Single Page HTML Summary: file:///D:/L4S1/ITQA/ITFac_Batch21_Group58/target/site/serenity/serenity-summary.html
[INFO] 
[INFO] --- failsafe:3.1.2:verify (default) @ cucumber-starter ---
[WARNING]  Parameter 'encoding' (user property 'encoding') is deprecated: since of 2.20.1
[INFO] ------------------------------------------------------------------------
[INFO] BUILD FAILURE
[INFO] ------------------------------------------------------------------------
[INFO] Total time:  29.633 s
[INFO] Finished at: 2026-02-06T04:29:50+05:30
[INFO] ------------------------------------------------------------------------
[ERROR] Failed to execute goal org.apache.maven.plugins:maven-failsafe-plugin:3.1.2:verify (default) on project cucumber-starter: There are test failures.
[ERROR] 
[ERROR] Please refer to D:\L4S1\ITQA\ITFac_Batch21_Group58\target\failsafe-reports for the individual test results.
[ERROR] Please refer to dump files (if any exist) [date].dump, [date]-jvmRun[N].dump and [date].dumpstream.
[ERROR] -> [Help 1]
[ERROR] 
[ERROR] To see the full stack trace of the errors, re-run Maven with the -e switch.
[ERROR] Re-run Maven using the -X switch to enable full debug logging.
[ERROR] 
[ERROR] For more information about the errors and possible solutions, please read the following articles:
[ERROR] [Help 1] http://cwiki.apache.org/confluence/display/MAVEN/MojoFailureException
